,Unnamed: 0.1,Unnamed: 0,title,year,user_tags,reviews,author,plot,poster
189,189,220,Back to the Future Part II,1989,"Adventure, Comedy, Sci-Fi","[{'source': 'Internet Movie Database', 'value': '7.8/10'}, {'source': 'Rotten Tomatoes', 'value': '63%'}, {'source': 'Metacritic', 'value': '57/100'}]",Robert Zemeckis,"After visiting 2015, Marty McFly must repeat his visit to 1955 to prevent disastrous changes to 1985...without interfering with his first trip.",Back_to_the_Future_Part_II.jpg
190,190,221,The Emoji Movie,2017,"Animation, Adventure, Comedy","[{'source': 'Internet Movie Database', 'value': '3.4/10'}, {'source': 'Rotten Tomatoes', 'value': '6%'}, {'source': 'Metacritic', 'value': '12/100'}]",Tony Leondis,"Gene, a multi-expressional emoji, sets out on a journey to become a normal emoji.",The_Emoji_Movie.jpg
191,191,222,ParaNorman,2012,"Animation, Adventure, Comedy","[{'source': 'Internet Movie Database', 'value': '7.0/10'}, {'source': 'Rotten Tomatoes', 'value': '89%'}, {'source': 'Metacritic', 'value': '72/100'}]","Chris Butler, Sam Fell","A misunderstood boy takes on ghosts, zombies and grown-ups to save his town from a centuries-old curse.",ParaNorman.jpg
192,192,223,The Descent,2005,"Adventure, Horror, Thriller","[{'source': 'Internet Movie Database', 'value': '7.2/10'}, {'source': 'Rotten Tomatoes', 'value': '87%'}, {'source': 'Metacritic', 'value': '71/100'}]",Neil Marshall,"A caving expedition goes horribly wrong, as the explorers become trapped and ultimately pursued by a strange breed of predators.",The_Descent.jpg
193,193,224,How to Train Your Dragon,2010,"Animation, Action, Adventure","[{'source': 'Internet Movie Database', 'value': '8.1/10'}, {'source': 'Rotten Tomatoes', 'value': '99%'}, {'source': 'Metacritic', 'value': '75/100'}]","Dean DeBlois, Chris Sanders","A hapless young Viking who aspires to hunt dragons becomes the unlikely friend of a young dragon himself, and learns there may be more to the creatures than he assumed.",How_to_Train_Your_Dragon.jpg
194,194,226,The Godfather Part III,1990,"Crime, Drama","[{'source': 'Internet Movie Database', 'value': '7.6/10'}, {'source': 'Rotten Tomatoes', 'value': '66%'}, {'source': 'Metacritic', 'value': '60/100'}]",Francis Ford Coppola,"Follows Michael Corleone, now in his 60s, as he seeks to free his family from crime and find a suitable successor to his empire.",The_Godfather_Part_III.jpg
195,195,227,Godzilla,2014,"Action, Adventure, Sci-Fi","[{'source': 'Internet Movie Database', 'value': '6.4/10'}, {'source': 'Rotten Tomatoes', 'value': '76%'}, {'source': 'Metacritic', 'value': '62/100'}]",Gareth Edwards,"The world is beset by the appearance of monstrous creatures, but one of them may be the only one who can save humanity.",Godzilla.jpg
196,196,228,The Wolf of Wall Street,2013,"Biography, Comedy, Crime","[{'source': 'Internet Movie Database', 'value': '8.2/10'}, {'source': 'Rotten Tomatoes', 'value': '79%'}, {'source': 'Metacritic', 'value': '75/100'}]",Martin Scorsese,"Based on the true story of Jordan Belfort, from his rise to a wealthy stock-broker living the high life to his fall involving crime, corruption and the federal government.",The_Wolf_of_Wall_Street.jpg
197,197,229,Pulp Fiction,1994,"Crime, Drama","[{'source': 'Internet Movie Database', 'value': '8.9/10'}, {'source': 'Rotten Tomatoes', 'value': '92%'}, {'source': 'Metacritic', 'value': '95/100'}]",Quentin Tarantino,"The lives of two mob hitmen, a boxer, a gangster and his wife, and a pair of diner bandits intertwine in four tales of violence and redemption.",Pulp_Fiction.jpg
198,198,230,The Godfather,1972,"Crime, Drama","[{'source': 'Internet Movie Database', 'value': '9.2/10'}, {'source': 'Rotten Tomatoes', 'value': '97%'}, {'source': 'Metacritic', 'value': '100/100'}]",Francis Ford Coppola,The aging patriarch of an organized crime dynasty transfers control of his clandestine empire to his reluctant son.,The_Godfather.jpg
199,199,231,The Nun,2018,"Horror, Mystery, Thriller","[{'source': 'Internet Movie Database', 'value': '5.4/10'}, {'source': 'Rotten Tomatoes', 'value': '24%'}, {'source': 'Metacritic', 'value': '46/100'}]",Corin Hardy,A priest with a haunted past and a novice on the threshold of her final vows are sent by the Vatican to investigate the death of a young nun in Romania and confront a malevolent force in the form of a demonic nun.,The_Nun.jpg
200,200,232,Thor,2011,"Action, Fantasy","[{'source': 'Internet Movie Database', 'value': '7.0/10'}, {'source': 'Rotten Tomatoes', 'value': '77%'}, {'source': 'Metacritic', 'value': '57/100'}]",Kenneth Branagh,"The powerful but arrogant god Thor is cast out of Asgard to live amongst humans in Midgard (Earth), where he soon becomes one of their finest defenders.",Thor.jpg
201,201,233,The BFG,2016,"Adventure, Family, Fantasy","[{'source': 'Internet Movie Database', 'value': '6.3/10'}, {'source': 'Rotten Tomatoes', 'value': '74%'}, {'source': 'Metacritic', 'value': '66/100'}]",Steven Spielberg,"An orphan little girl befriends a benevolent giant who takes her to Giant Country, where they attempt to stop the man-eating giants that are invading the human world.",The_BFG.jpg
202,202,235,Superbad,2007,Comedy,"[{'source': 'Internet Movie Database', 'value': '7.6/10'}, {'source': 'Rotten Tomatoes', 'value': '88%'}, {'source': 'Metacritic', 'value': '76/100'}]",Greg Mottola,Two co-dependent high school seniors are forced to deal with separation anxiety after their plan to stage a booze-soaked party goes awry.,Superbad.jpg
203,203,236,Moana,2016,"Animation, Adventure, Comedy","[{'source': 'Internet Movie Database', 'value': '7.6/10'}, {'source': 'Rotten Tomatoes', 'value': '95%'}, {'source': 'Metacritic', 'value': '81/100'}]","Ron Clements, John Musker, Don Hall","In ancient Polynesia, when a terrible curse incurred by the demigod Maui reaches Moana's island, she answers the Ocean's call to seek out Maui to set things right.",Moana.jpg
204,204,237,The Croods,2013,"Animation, Adventure, Comedy","[{'source': 'Internet Movie Database', 'value': '7.1/10'}, {'source': 'Rotten Tomatoes', 'value': '71%'}, {'source': 'Metacritic', 'value': '55/100'}]","Kirk DeMicco, Chris Sanders","In the primeval era, Grug and his family risk the dangers of their surroundings to find a new dwelling place. Along the way, they meet a modern boy who woos them with his adventurous ways.",The_Croods.jpg
205,205,239,The Karate Kid,1984,"Action, Drama, Family","[{'source': 'Internet Movie Database', 'value': '7.3/10'}, {'source': 'Rotten Tomatoes', 'value': '90%'}, {'source': 'Metacritic', 'value': '61/100'}]",John G. Avildsen,"Recently relocated from NJ to LA, Daniel becomes the target of a gang of Cobra Kai dojo students. When Mr. Miyagi saves him with expert Karate skills, Daniel convinces him to teach him to defend himself, and put his bullies in the...",The_Karate_Kid.jpg
206,206,240,Tangled,2010,"Animation, Adventure, Comedy","[{'source': 'Internet Movie Database', 'value': '7.7/10'}, {'source': 'Rotten Tomatoes', 'value': '89%'}, {'source': 'Metacritic', 'value': '71/100'}]","Nathan Greno, Byron Howard","The magically long-haired Rapunzel has spent her entire life in a tower, but now that a runaway thief has stumbled upon her, she is about to discover the world for the first time, and who she really is.",Tangled.jpg
207,207,241,V for Vendetta,2005,"Action, Drama, Sci-Fi","[{'source': 'Internet Movie Database', 'value': '8.1/10'}, {'source': 'Rotten Tomatoes', 'value': '73%'}, {'source': 'Metacritic', 'value': '62/100'}]",James McTeigue,"In a future British dystopian society, a shadowy freedom fighter, known only by the alias of ""V"", plots to overthrow the tyrannical government - with the help of a young woman.",V_for_Vendetta.jpg
208,208,242,Captain Marvel,2019,"Action, Adventure, Sci-Fi","[{'source': 'Internet Movie Database', 'value': '6.8/10'}, {'source': 'Rotten Tomatoes', 'value': '79%'}, {'source': 'Metacritic', 'value': '64/100'}]","Anna Boden, Ryan Fleck",Carol Danvers becomes one of the universe's most powerful heroes when Earth is caught in the middle of a galactic war between two alien races.,Captain_Marvel.jpg
209,209,243,Lilo & Stitch,2002,"Animation, Adventure, Comedy","[{'source': 'Internet Movie Database', 'value': '7.3/10'}, {'source': 'Rotten Tomatoes', 'value': '87%'}, {'source': 'Metacritic', 'value': '74/100'}]","Dean DeBlois, Chris Sanders","A young and parentless girl adopts a 'dog' from the local pound, completely unaware that it's supposedly a dangerous scientific experiment that's taken refuge on Earth and is now hiding from its creator and those who see it as a m...",Lilo_&_Stitch.jpg
210,210,244,The Matrix Reloaded,2003,"Action, Sci-Fi","[{'source': 'Internet Movie Database', 'value': '7.2/10'}, {'source': 'Rotten Tomatoes', 'value': '74%'}, {'source': 'Metacritic', 'value': '62/100'}]","Lana Wachowski, Lilly Wachowski","Freedom fighters Neo, Trinity and Morpheus continue to lead the revolt against the Machine Army, unleashing their arsenal of extraordinary skills and weaponry against the systematic forces of repression and exploitation.",The_Matrix_Reloaded.jpg
211,211,245,My Big Fat Greek Wedding,2002,"Comedy, Drama, Romance","[{'source': 'Internet Movie Database', 'value': '6.6/10'}, {'source': 'Rotten Tomatoes', 'value': '76%'}, {'source': 'Metacritic', 'value': '62/100'}]",Joel Zwick,A young Greek woman falls in love with a non-Greek and struggles to get her family to accept him while she comes to terms with her heritage and cultural identity.,My_Big_Fat_Greek_Wedding.jpg
212,212,246,Sing,2016,"Animation, Comedy, Family","[{'source': 'Internet Movie Database', 'value': '7.1/10'}, {'source': 'Rotten Tomatoes', 'value': '71%'}, {'source': 'Metacritic', 'value': '59/100'}]","Garth Jennings, Christophe Lourdelet","In a city of humanoid animals, a hustling theater impresario's attempt to save his theater with a singing competition becomes grander than he anticipates even as its finalists find that their lives will never be the same.",Sing.jpg
213,213,247,Inside Out,2015,"Animation, Adventure, Comedy","[{'source': 'Internet Movie Database', 'value': '8.1/10'}, {'source': 'Rotten Tomatoes', 'value': '98%'}, {'source': 'Metacritic', 'value': '94/100'}]","Pete Docter, Ronnie Del Carmen","After young Riley is uprooted from her Midwest life and moved to San Francisco, her emotions - Joy, Fear, Anger, Disgust and Sadness - conflict on how best to navigate a new city, house, and school.",Inside_Out.jpg
214,214,248,The Outsiders,1983,"Crime, Drama","[{'source': 'Internet Movie Database', 'value': '7.0/10'}, {'source': 'Rotten Tomatoes', 'value': '71%'}, {'source': 'Metacritic', 'value': '45/100'}]",Francis Ford Coppola,"In a small Oklahoma town in 1964, the rivalry between two gangs, the poor Greasers and the rich Socs, heats up when one gang member accidentally kills a member of the other.",The_Outsiders.jpg
215,215,249,Cinderella,2015,"Adventure, Drama, Family","[{'source': 'Internet Movie Database', 'value': '6.9/10'}, {'source': 'Rotten Tomatoes', 'value': '84%'}, {'source': 'Metacritic', 'value': '67/100'}]",Kenneth Branagh,"When her father unexpectedly dies, young Ella finds herself at the mercy of her cruel stepmother and her scheming stepsisters. Never one to give up hope, Ella's fortunes begin to change after meeting a dashing stranger.",Cinderella.jpg
216,216,250,Catch Me If You Can,2002,"Biography, Crime, Drama","[{'source': 'Internet Movie Database', 'value': '8.1/10'}, {'source': 'Rotten Tomatoes', 'value': '96%'}, {'source': 'Metacritic', 'value': '75/100'}]",Steven Spielberg,"Barely 17 yet, Frank is a skilled forger who has passed as a doctor, lawyer and pilot. FBI agent Carl becomes obsessed with tracking down the con man, who only revels in the pursuit.",Catch_Me_If_You_Can.jpg
217,217,252,The Hateful Eight,2015,"Crime, Drama, Mystery","[{'source': 'Internet Movie Database', 'value': '7.8/10'}, {'source': 'Rotten Tomatoes', 'value': '74%'}, {'source': 'Metacritic', 'value': '68/100'}]",Quentin Tarantino,"In the dead of a Wyoming winter, a bounty hunter and his prisoner find shelter in a cabin currently inhabited by a collection of nefarious characters.",The_Hateful_Eight.jpg
218,218,253,Up,2009,"Animation, Adventure, Comedy","[{'source': 'Internet Movie Database', 'value': '8.3/10'}, {'source': 'Rotten Tomatoes', 'value': '98%'}, {'source': 'Metacritic', 'value': '88/100'}]","Pete Docter, Bob Peterson","78-year-old Carl Fredricksen travels to South America in his house equipped with balloons, inadvertently taking a young stowaway.",Up.jpg
219,219,254,The Sword in the Stone,1963,"Animation, Adventure, Comedy","[{'source': 'Internet Movie Database', 'value': '7.1/10'}, {'source': 'Rotten Tomatoes', 'value': '66%'}, {'source': 'Metacritic', 'value': '61/100'}]","Wolfgang Reitherman, Clyde Geronimi, David Hand","A poor boy named Arthur learns the power of love, kindness, knowledge and bravery with the help of a wizard called Merlin in the path to become one of the most beloved kings in English history.",The_Sword_in_the_Stone.jpg
220,220,255,The Borrowers,1997,"Adventure, Comedy, Family","[{'source': 'Internet Movie Database', 'value': '5.9/10'}, {'source': 'Rotten Tomatoes', 'value': '75%'}]",Peter Hewitt,A secret family of four-inch people living inside the walls of a house must save their home from an evil real estate developer.,The_Borrowers.jpg
221,221,256,Her,2013,"Drama, Romance, Sci-Fi","[{'source': 'Internet Movie Database', 'value': '8.0/10'}, {'source': 'Rotten Tomatoes', 'value': '95%'}, {'source': 'Metacritic', 'value': '91/100'}]",Spike Jonze,"In the near future, a lonely writer develops an unlikely relationship with an operating system designed to meet his every need.",Her.jpg
222,222,258,Sing 2,2021,"Animation, Adventure, Comedy","[{'source': 'Internet Movie Database', 'value': '7.3/10'}, {'source': 'Rotten Tomatoes', 'value': '72%'}, {'source': 'Metacritic', 'value': '49/100'}]","Garth Jennings, Christophe Lourdelet",Buster Moon and his friends must persuade reclusive rock star Clay Calloway to join them for the opening of a new show.,Sing_2.jpg
223,223,259,Divergent,2014,"Action, Adventure, Mystery","[{'source': 'Internet Movie Database', 'value': '6.6/10'}, {'source': 'Rotten Tomatoes', 'value': '41%'}, {'source': 'Metacritic', 'value': '48/100'}]",Neil Burger,"In a world divided by factions based on virtues, Tris learns she's Divergent and won't fit in. When she discovers a plot to destroy Divergents, Tris and the mysterious Four must find out what makes Divergents dangerous before it's...",Divergent.jpg
224,224,260,Annabelle,2014,"Horror, Mystery, Thriller","[{'source': 'Internet Movie Database', 'value': '5.5/10'}, {'source': 'Rotten Tomatoes', 'value': '28%'}, {'source': 'Metacritic', 'value': '37/100'}]",John R. Leonetti,A couple begins to experience terrifying supernatural occurrences involving a vintage doll shortly after their home is invaded by satanic cultists.,Annabelle.jpg
225,225,261,Elektra,2005,"Action, Adventure, Crime","[{'source': 'Internet Movie Database', 'value': '4.7/10'}, {'source': 'Rotten Tomatoes', 'value': '11%'}, {'source': 'Metacritic', 'value': '34/100'}]",Rob Bowman,An assassin's change of heart leads her into a war against an evil crime syndicate.,Elektra.jpg
226,226,263,Memento,2000,"Mystery, Thriller","[{'source': 'Internet Movie Database', 'value': '8.4/10'}, {'source': 'Rotten Tomatoes', 'value': '94%'}, {'source': 'Metacritic', 'value': '83/100'}]",Christopher Nolan,"Leonard Shelby, an insurance investigator, suffers from anterograde amnesia and uses notes and tattoos to hunt for the man he thinks killed his wife, which is the last thing he remembers.",Memento.jpg
227,227,264,"Crazy, Stupid, Love.",2011,"Comedy, Drama, Romance","[{'source': 'Internet Movie Database', 'value': '7.4/10'}, {'source': 'Rotten Tomatoes', 'value': '79%'}, {'source': 'Metacritic', 'value': '68/100'}]","Glenn Ficarra, John Requa","A middle-aged husband's life changes dramatically when his wife asks him for a divorce. He seeks to rediscover his manhood with the help of a newfound friend, Jacob, learning to pick up girls at bars.","Crazy,_Stupid,_Love.jpg"
228,228,265,You've Got Mail,1998,"Comedy, Drama, Romance","[{'source': 'Internet Movie Database', 'value': '6.7/10'}, {'source': 'Rotten Tomatoes', 'value': '70%'}, {'source': 'Metacritic', 'value': '58/100'}]",Nora Ephron,"Book superstore magnate Joe Fox and independent book shop owner Kathleen Kelly fall in love in the anonymity of the Internet, both blissfully unaware that he's trying to put her out of business.",You've_Got_Mail.jpg
229,229,266,The Secret Life of Walter Mitty,2013,"Adventure, Comedy, Drama","[{'source': 'Internet Movie Database', 'value': '7.3/10'}, {'source': 'Rotten Tomatoes', 'value': '52%'}, {'source': 'Metacritic', 'value': '54/100'}]",Ben Stiller,"When both he and a colleague are about to lose their job, Walter takes action by embarking on an adventure more extraordinary than anything he ever imagined.",The_Secret_Life_of_Walter_Mitty.jpg
230,230,268,Sixteen Candles,1984,"Comedy, Romance","[{'source': 'Internet Movie Database', 'value': '7.0/10'}, {'source': 'Rotten Tomatoes', 'value': '81%'}, {'source': 'Metacritic', 'value': '61/100'}]",John Hughes,"A girl's ""sweet"" sixteenth birthday is anything but special: her family forgets about it, and she suffers from every embarrassment possible.",Sixteen_Candles.jpg
231,231,269,Army of Darkness,1992,"Comedy, Horror","[{'source': 'Internet Movie Database', 'value': '7.4/10'}, {'source': 'Rotten Tomatoes', 'value': '68%'}, {'source': 'Metacritic', 'value': '59/100'}]",Sam Raimi,"When Ash Williams is accidentally transported to 1300 A.D., he must retrieve the Necronomicon and battle an army of the dead in order to return home.",Army_of_Darkness.jpg
232,232,270,The Orphanage,2007,"Drama, Horror, Mystery","[{'source': 'Internet Movie Database', 'value': '7.4/10'}, {'source': 'Rotten Tomatoes', 'value': '87%'}, {'source': 'Metacritic', 'value': '74/100'}]",J.A. Bayona,"A woman brings her family back to her childhood home, which used to be an orphanage for handicapped children. Before long, her son starts to communicate with an invisible new friend.",The_Orphanage.jpg
233,233,272,The Lion King,1994,"Animation, Adventure, Drama","[{'source': 'Internet Movie Database', 'value': '8.5/10'}, {'source': 'Rotten Tomatoes', 'value': '93%'}, {'source': 'Metacritic', 'value': '88/100'}]","Roger Allers, Rob Minkoff","Lion prince Simba and his father are targeted by his bitter uncle, who wants to ascend the throne himself.",The_Lion_King.jpg
234,234,273,The Goonies,1985,"Adventure, Comedy, Family","[{'source': 'Internet Movie Database', 'value': '7.7/10'}, {'source': 'Rotten Tomatoes', 'value': '77%'}, {'source': 'Metacritic', 'value': '62/100'}]",Richard Donner,A group of young misfits called The Goonies discover an ancient map and set out on an adventure to find a legendary pirate's long-lost treasure.,The_Goonies.jpg
235,235,274,Mystic River,2003,"Crime, Drama, Mystery","[{'source': 'Internet Movie Database', 'value': '7.9/10'}, {'source': 'Rotten Tomatoes', 'value': '89%'}, {'source': 'Metacritic', 'value': '84/100'}]",Clint Eastwood,"The tragic murder of a 19-year-old girl reunites three childhood friends still living in Boston--the victim's gangster father, a detective, and the disturbed man they both suspect of killing her.",Mystic_River.jpg
236,236,275,The Machinist,2004,"Drama, Thriller","[{'source': 'Internet Movie Database', 'value': '7.6/10'}, {'source': 'Rotten Tomatoes', 'value': '77%'}, {'source': 'Metacritic', 'value': '61/100'}]",Brad Anderson,An industrial worker who hasn't slept in a year begins to doubt his own sanity.,The_Machinist.jpg
237,237,276,King Kong,2005,"Action, Adventure, Romance","[{'source': 'Internet Movie Database', 'value': '7.2/10'}, {'source': 'Rotten Tomatoes', 'value': '84%'}, {'source': 'Metacritic', 'value': '81/100'}]",Peter Jackson,"A greedy film producer assembles a team of moviemakers and sets out for the infamous Skull Island, where they find more than just cannibalistic natives.",King_Kong.jpg
238,238,277,Beauty and the Beast,1991,"Animation, Family, Fantasy","[{'source': 'Internet Movie Database', 'value': '8.0/10'}, {'source': 'Rotten Tomatoes', 'value': '95%'}, {'source': 'Metacritic', 'value': '95/100'}]","Gary Trousdale, Kirk Wise",A prince cursed to spend his days as a hideous monster sets out to regain his humanity by earning a young woman's love.,Beauty_and_the_Beast.jpg
239,239,278,Terminator Salvation,2009,"Action, Adventure, Sci-Fi","[{'source': 'Internet Movie Database', 'value': '6.5/10'}, {'source': 'Rotten Tomatoes', 'value': '33%'}, {'source': 'Metacritic', 'value': '49/100'}]",McG,"As the machines prepare for a final attack, John Connor and a mysterious stranger delve into the heart of Skynet and uncover a terrible secret involving the annihilation of mankind.",Terminator_Salvation.jpg
240,240,280,The Count of Monte Cristo,2002,"Action, Adventure, Drama","[{'source': 'Internet Movie Database', 'value': '7.7/10'}, {'source': 'Rotten Tomatoes', 'value': '74%'}, {'source': 'Metacritic', 'value': '61/100'}]",Kevin Reynolds,"A young man, falsely imprisoned by his jealous ""friend"", escapes and uses a hidden treasure to exact his revenge.",The_Count_of_Monte_Cristo.jpg
241,241,281,Ferris Bueller's Day Off,1986,Comedy,"[{'source': 'Internet Movie Database', 'value': '7.8/10'}, {'source': 'Rotten Tomatoes', 'value': '83%'}, {'source': 'Metacritic', 'value': '61/100'}]",John Hughes,"A brash, cocky high school senior, tired of skipping school to spend a boring day at home, is determined to enjoy an epic day roaring around his favorite Chicago sites, enlisting his best friend and girlfriend to join him on the a...",Ferris_Bueller's_Day_Off.jpg
242,242,283,The Usual Suspects,1995,"Crime, Drama, Mystery","[{'source': 'Internet Movie Database', 'value': '8.5/10'}, {'source': 'Rotten Tomatoes', 'value': '87%'}, {'source': 'Metacritic', 'value': '76/100'}]",Bryan Singer,The sole survivor of a pier shoot-out tells the story of how a notorious criminal influenced the events that began with five criminals meeting in a seemingly random police lineup.,The_Usual_Suspects.jpg
243,243,284,The Thing,1982,"Horror, Mystery, Sci-Fi","[{'source': 'Internet Movie Database', 'value': '8.2/10'}, {'source': 'Rotten Tomatoes', 'value': '85%'}, {'source': 'Metacritic', 'value': '57/100'}]",John Carpenter,A research team in Antarctica is hunted by a shape-shifting alien that assumes the appearance of its victims.,The_Thing.jpg
244,244,286,E.T. the Extra-Terrestrial,1982,"Adventure, Family, Sci-Fi","[{'source': 'Internet Movie Database', 'value': '7.9/10'}, {'source': 'Rotten Tomatoes', 'value': '99%'}, {'source': 'Metacritic', 'value': '92/100'}]",Steven Spielberg,A troubled child summons the courage to help a friendly alien escape from Earth and return to his home planet.,E.T._the_Extra-Terrestrial.jpg
245,245,288,Home on the Range,2004,"Animation, Adventure, Comedy","[{'source': 'Internet Movie Database', 'value': '5.4/10'}, {'source': 'Rotten Tomatoes', 'value': '52%'}, {'source': 'Metacritic', 'value': '50/100'}]","Will Finn, John Sanford","To save their farm, the resident animals go bounty hunting for a notorious outlaw.",Home_on_the_Range.jpg
246,246,289,The Departed,2006,"Crime, Drama, Thriller","[{'source': 'Internet Movie Database', 'value': '8.5/10'}, {'source': 'Rotten Tomatoes', 'value': '91%'}, {'source': 'Metacritic', 'value': '85/100'}]",Martin Scorsese,An undercover cop and a mole in the police attempt to identify each other while infiltrating an Irish gang in South Boston.,The_Departed.jpg
247,247,290,The Maze Runner,2014,"Mystery, Sci-Fi, Thriller","[{'source': 'Internet Movie Database', 'value': '6.8/10'}, {'source': 'Rotten Tomatoes', 'value': '66%'}, {'source': 'Metacritic', 'value': '57/100'}]",Wes Ball,"Thomas is deposited in a community of boys after his memory is erased, soon learning they're all trapped in a maze that will require him to join forces with fellow ""runners"" for a shot at escape.",The_Maze_Runner.jpg
248,248,292,The Conjuring,2013,"Horror, Mystery, Thriller","[{'source': 'Internet Movie Database', 'value': '7.5/10'}, {'source': 'Rotten Tomatoes', 'value': '86%'}, {'source': 'Metacritic', 'value': '68/100'}]",James Wan,Paranormal investigators Ed and Lorraine Warren work to help a family terrorized by a dark presence in their farmhouse.,The_Conjuring.jpg
249,249,293,Drive,2011,"Action, Drama","[{'source': 'Internet Movie Database', 'value': '7.8/10'}, {'source': 'Rotten Tomatoes', 'value': '93%'}, {'source': 'Metacritic', 'value': '79/100'}]",Nicolas Winding Refn,A mysterious Hollywood action film stuntman gets in trouble with gangsters when he tries to help his neighbor's husband rob a pawn shop while serving as his getaway driver.,Drive.jpg
250,250,295,Love Actually,2003,"Comedy, Drama, Romance","[{'source': 'Internet Movie Database', 'value': '7.6/10'}, {'source': 'Rotten Tomatoes', 'value': '64%'}, {'source': 'Metacritic', 'value': '55/100'}]",Richard Curtis,"Follows the lives of eight very different couples in dealing with their love lives in various loosely interrelated tales all set during a frantic month before Christmas in London, England.",Love_Actually.jpg
251,251,296,Black Swan,2010,"Drama, Thriller","[{'source': 'Internet Movie Database', 'value': '8.0/10'}, {'source': 'Rotten Tomatoes', 'value': '85%'}, {'source': 'Metacritic', 'value': '79/100'}]",Darren Aronofsky,"Nina is a talented but unstable ballerina on the verge of stardom. Pushed to the breaking point by her artistic director and a seductive rival, Nina's grip on reality slips, plunging her into a waking nightmare.",Black_Swan.jpg
