,Unnamed: 0.1,Unnamed: 0,title,year,user_tags,reviews,author,plot,poster
252,252,297,Inception,2010,"Action, Adventure, Sci-Fi","[{'source': 'Internet Movie Database', 'value': '8.8/10'}, {'source': 'Rotten Tomatoes', 'value': '87%'}, {'source': 'Metacritic', 'value': '74/100'}]",Christopher Nolan,"A thief who steals corporate secrets through the use of dream-sharing technology is given the inverse task of planting an idea into the mind of a C.E.O., but his tragic past may doom the project and his team to disaster.",Inception.jpg
253,253,298,The Mist,2007,"Horror, Sci-Fi, Thriller","[{'source': 'Internet Movie Database', 'value': '7.1/10'}, {'source': 'Rotten Tomatoes', 'value': '73%'}, {'source': 'Metacritic', 'value': '58/100'}]",Frank Darabont,"After a massive thunderstorm, an eerie, unwavering fog descends upon a Maine community. Locals seek refuge in a grocery store from the monstrous creatures now roaming the countryside killing everyone they encounter.",The_Mist.jpg
254,254,299,Shrek the Third,2007,"Animation, Adventure, Comedy","[{'source': 'Internet Movie Database', 'value': '6.1/10'}, {'source': 'Rotten Tomatoes', 'value': '41%'}, {'source': 'Metacritic', 'value': '58/100'}]","Chris Miller, Raman Hui","Reluctantly designated as the heir to the land of Far, Far Away, Shrek hatches a plan to install the rebellious Artie as the new king while Princess Fiona tries to fend off a coup d'état by the jilted Prince Charming.",Shrek_the_Third.jpg
255,255,300,Shrek,2001,"Animation, Adventure, Comedy","[{'source': 'Internet Movie Database', 'value': '7.9/10'}, {'source': 'Rotten Tomatoes', 'value': '88%'}, {'source': 'Metacritic', 'value': '84/100'}]","Andrew Adamson, Vicky Jenson","A mean lord exiles fairytale creatures to the swamp of a grumpy ogre, who must go on a quest and rescue a princess for the lord in order to get his land back.",Shrek.jpg
256,256,301,American Sniper,2014,"Action, Biography, Drama","[{'source': 'Internet Movie Database', 'value': '7.3/10'}, {'source': 'Rotten Tomatoes', 'value': '72%'}, {'source': 'Metacritic', 'value': '73/100'}]",Clint Eastwood,"Navy S.E.A.L. sniper Chris Kyle's pinpoint accuracy saves countless lives on the battlefield and turns him into a legend. Back home with his family after four tours of duty, however, Chris finds that it is the war he can't leave b...",American_Sniper.jpg
257,257,302,The Shape of Water,2017,"Drama, Fantasy, Romance","[{'source': 'Internet Movie Database', 'value': '7.3/10'}, {'source': 'Rotten Tomatoes', 'value': '92%'}, {'source': 'Metacritic', 'value': '87/100'}]",Guillermo del Toro,"At a top secret research facility in the 1960s, a lonely janitor forms a unique relationship with an amphibious creature that is being held in captivity.",The_Shape_of_Water.jpg
258,258,303,Shazam!,2019,"Action, Adventure, Comedy","[{'source': 'Internet Movie Database', 'value': '7.0/10'}, {'source': 'Rotten Tomatoes', 'value': '90%'}, {'source': 'Metacritic', 'value': '71/100'}]",David F. Sandberg,A newly fostered young boy in search of his mother instead finds unexpected super powers and soon gains a powerful enemy.,Shazam!.jpg
259,259,304,Reservoir Dogs,1992,"Crime, Thriller","[{'source': 'Internet Movie Database', 'value': '8.3/10'}, {'source': 'Rotten Tomatoes', 'value': '90%'}, {'source': 'Metacritic', 'value': '81/100'}]",Quentin Tarantino,"When a simple jewelry heist goes horribly wrong, the surviving criminals begin to suspect that one of them is a police informant.",Reservoir_Dogs.jpg
260,260,305,The Amazing Spider-Man,2012,"Action, Adventure, Sci-Fi","[{'source': 'Internet Movie Database', 'value': '6.9/10'}, {'source': 'Rotten Tomatoes', 'value': '71%'}, {'source': 'Metacritic', 'value': '66/100'}]",Marc Webb,"After Peter Parker is bitten by a genetically altered spider, he gains newfound, spider-like powers and ventures out to save the city from the machinations of a mysterious reptilian foe.",The_Amazing_Spider-Man.jpg
261,261,306,Moneyball,2011,"Biography, Drama, Sport","[{'source': 'Internet Movie Database', 'value': '7.6/10'}, {'source': 'Rotten Tomatoes', 'value': '94%'}, {'source': 'Metacritic', 'value': '87/100'}]",Bennett Miller,Oakland A's general manager Billy Beane's successful attempt to assemble a baseball team on a lean budget by employing computer-generated analysis to acquire new players.,Moneyball.jpg
262,262,307,The Lego Batman Movie,2017,"Animation, Action, Adventure","[{'source': 'Internet Movie Database', 'value': '7.3/10'}, {'source': 'Rotten Tomatoes', 'value': '89%'}, {'source': 'Metacritic', 'value': '75/100'}]",Chris McKay,"A cooler-than-ever Bruce Wayne must deal with the usual suspects as they plan to rule Gotham City, while discovering that he has accidentally adopted a teenage orphan who wishes to become his sidekick.",The_Lego_Batman_Movie.jpg
263,263,309,The Sixth Sense,1999,"Drama, Mystery, Thriller","[{'source': 'Internet Movie Database', 'value': '8.2/10'}, {'source': 'Rotten Tomatoes', 'value': '86%'}, {'source': 'Metacritic', 'value': '64/100'}]",M. Night Shyamalan,"After being shot by a resentful former patient whom he failed to help, a Philadelphia child psychologist seeks redemption by treating a young boy with a disturbing secret.",The_Sixth_Sense.jpg
264,264,310,Silver Linings Playbook,2012,"Comedy, Drama, Romance","[{'source': 'Internet Movie Database', 'value': '7.7/10'}, {'source': 'Rotten Tomatoes', 'value': '92%'}, {'source': 'Metacritic', 'value': '81/100'}]",David O. Russell,"After a stint in a mental institution, former teacher Pat Solitano moves back in with his parents and tries to reconcile with his ex-wife. Things get more challenging when Pat meets Tiffany, a mysterious girl with problems of her ...",Silver_Linings_Playbook.jpg
265,265,311,Justice League,2017,"Action, Adventure, Fantasy","[{'source': 'Internet Movie Database', 'value': '6.1/10'}, {'source': 'Rotten Tomatoes', 'value': '39%'}, {'source': 'Metacritic', 'value': '45/100'}]",Zack Snyder,"Steppenwolf and his Parademons return after eons to capture Earth. However, Batman seeks the help of Wonder Woman to recruit and assemble Flash, Cyborg and Aquaman to fight the powerful new enemy.",Justice_League.jpg
266,266,312,Shrek Forever After,2010,"Animation, Adventure, Comedy","[{'source': 'Internet Movie Database', 'value': '6.3/10'}, {'source': 'Rotten Tomatoes', 'value': '58%'}, {'source': 'Metacritic', 'value': '58/100'}]",Mike Mitchell,Rumpelstiltskin tricks a mid-life crisis burdened Shrek into allowing himself to be erased from existence and cast in a dark alternate timeline where Rumpelstiltskin rules supreme.,Shrek_Forever_After.jpg
267,267,314,Jurassic Park,1993,"Action, Adventure, Sci-Fi","[{'source': 'Internet Movie Database', 'value': '8.2/10'}, {'source': 'Rotten Tomatoes', 'value': '91%'}, {'source': 'Metacritic', 'value': '68/100'}]",Steven Spielberg,"An industrialist invites some experts to visit his theme park of cloned dinosaurs. After a power failure, the creatures run loose, putting everyone's lives, including his grandchildren's, in danger.",Jurassic_Park.jpg
268,268,315,Aardvark,2017,Drama,"[{'source': 'Internet Movie Database', 'value': '4.5/10'}, {'source': 'Rotten Tomatoes', 'value': '8%'}, {'source': 'Metacritic', 'value': '37/100'}]",Brian Shoaf,The aardvark has evolved to be one of a kind. You could say the same of Josh Norman.,Aardvark.jpg
269,269,316,It Comes at Night,2017,"Drama, Horror, Mystery","[{'source': 'Internet Movie Database', 'value': '6.1/10'}, {'source': 'Rotten Tomatoes', 'value': '87%'}, {'source': 'Metacritic', 'value': '78/100'}]",Trey Edward Shults,"Secure within a desolate home as an unnatural threat terrorizes the world, a man has established a tenuous domestic order with his wife and son. Then a desperate young family arrives seeking refuge.",It_Comes_at_Night.jpg
270,270,317,Shutter Island,2010,"Drama, Mystery, Thriller","[{'source': 'Internet Movie Database', 'value': '8.2/10'}, {'source': 'Rotten Tomatoes', 'value': '69%'}, {'source': 'Metacritic', 'value': '63/100'}]",Martin Scorsese,Two US marshals are sent to a mental institution on an inhospitable island in order to investigate the disappearance of a patient.,Shutter_Island.jpg
271,271,318,Toy Story 2,1999,"Animation, Adventure, Comedy","[{'source': 'Internet Movie Database', 'value': '7.9/10'}, {'source': 'Rotten Tomatoes', 'value': '100%'}, {'source': 'Metacritic', 'value': '88/100'}]","John Lasseter, Ash Brannon, Lee Unkrich","When Woody is stolen by a toy collector, Buzz and his friends set out on a rescue mission to save Woody before he becomes a museum toy property with his roundup gang Jessie, Prospector, and Bullseye.",Toy_Story_2.jpg
272,272,319,Sin City,2005,"Crime, Thriller","[{'source': 'Internet Movie Database', 'value': '8.0/10'}, {'source': 'Rotten Tomatoes', 'value': '76%'}, {'source': 'Metacritic', 'value': '74/100'}]","Frank Miller, Quentin Tarantino, Robert Rodriguez","An exploration of the dark and miserable Basin City and three of its residents, all of whom are caught up in violent corruption.",Sin_City.jpg
273,273,320,The Theory of Everything,2014,"Biography, Drama, Romance","[{'source': 'Internet Movie Database', 'value': '7.7/10'}, {'source': 'Rotten Tomatoes', 'value': '81%'}, {'source': 'Metacritic', 'value': '71/100'}]",James Marsh,Stephen Hawking gets unprecedented success in the field of physics despite being diagnosed with motor neuron disease at the age of 21. He defeats awful odds as his first wife Jane aids him loyally.,The_Theory_of_Everything.jpg
274,274,321,Elf,2003,"Adventure, Comedy, Family","[{'source': 'Internet Movie Database', 'value': '7.1/10'}, {'source': 'Rotten Tomatoes', 'value': '86%'}, {'source': 'Metacritic', 'value': '66/100'}]",Jon Favreau,"Raised as an oversized elf, Buddy travels from the North Pole to New York City to meet his biological father, Walter Hobbs, who doesn't know he exists and is in desperate need of some Christmas spirit.",Elf.jpg
275,275,322,The Avengers,2012,"Action, Sci-Fi","[{'source': 'Internet Movie Database', 'value': '8.0/10'}, {'source': 'Rotten Tomatoes', 'value': '91%'}, {'source': 'Metacritic', 'value': '69/100'}]",Joss Whedon,Earth's mightiest heroes must come together and learn to fight as a team if they are going to stop the mischievous Loki and his alien army from enslaving humanity.,The_Avengers.jpg
276,276,323,Iron Man 3,2013,"Action, Adventure, Sci-Fi","[{'source': 'Internet Movie Database', 'value': '7.1/10'}, {'source': 'Rotten Tomatoes', 'value': '79%'}, {'source': 'Metacritic', 'value': '62/100'}]",Shane Black,"When Tony Stark's world is torn apart by a formidable terrorist called the Mandarin, he starts an odyssey of rebuilding and retribution.",Iron_Man_3.jpg
277,277,324,The Green Mile,1999,"Crime, Drama, Fantasy","[{'source': 'Internet Movie Database', 'value': '8.6/10'}, {'source': 'Rotten Tomatoes', 'value': '79%'}, {'source': 'Metacritic', 'value': '61/100'}]",Frank Darabont,"Paul Edgecomb, the head guard of a prison, meets an inmate, John Coffey, a black man who is accused of murdering two girls. His life changes drastically when he discovers that John has a special gift.",The_Green_Mile.jpg
278,278,325,Spider-Man 2,2004,"Action, Adventure, Sci-Fi","[{'source': 'Internet Movie Database', 'value': '7.5/10'}, {'source': 'Rotten Tomatoes', 'value': '93%'}, {'source': 'Metacritic', 'value': '83/100'}]",Sam Raimi,Peter Parker is beset with troubles in his failing personal life as he battles a former brilliant scientist named Otto Octavius.,Spider-Man_2.jpg
279,279,326,Dumbo,1941,"Animation, Adventure, Drama","[{'source': 'Internet Movie Database', 'value': '7.2/10'}, {'source': 'Rotten Tomatoes', 'value': '95%'}, {'source': 'Metacritic', 'value': '96/100'}]","Samuel Armstrong, Norman Ferguson, Wilfred Jackson","Ridiculed because of his enormous ears, a young circus elephant is assisted by a mouse to achieve his full potential.",Dumbo.jpg
280,280,327,Paranormal Activity,2007,"Horror, Mystery","[{'source': 'Internet Movie Database', 'value': '6.3/10'}, {'source': 'Rotten Tomatoes', 'value': '83%'}, {'source': 'Metacritic', 'value': '68/100'}]",Oren Peli,"After moving into a suburban home, a couple becomes increasingly disturbed by a nightly demonic presence.",Paranormal_Activity.jpg
281,281,328,Iron Man,2008,"Action, Adventure, Sci-Fi","[{'source': 'Internet Movie Database', 'value': '7.9/10'}, {'source': 'Rotten Tomatoes', 'value': '94%'}, {'source': 'Metacritic', 'value': '79/100'}]",Jon Favreau,"After being held captive in an Afghan cave, billionaire engineer Tony Stark creates a unique weaponized suit of armor to fight evil.",Iron_Man.jpg
282,282,329,The Grand Budapest Hotel,2014,"Adventure, Comedy, Crime","[{'source': 'Internet Movie Database', 'value': '8.1/10'}, {'source': 'Rotten Tomatoes', 'value': '92%'}, {'source': 'Metacritic', 'value': '88/100'}]",Wes Anderson,"A writer encounters the owner of an aging high-class hotel, who tells him of his early years serving as a lobby boy in the hotel's glorious years under an exceptional concierge.",The_Grand_Budapest_Hotel.jpg
283,283,332,The Babadook,2014,"Drama, Horror, Mystery","[{'source': 'Internet Movie Database', 'value': '6.8/10'}, {'source': 'Rotten Tomatoes', 'value': '98%'}, {'source': 'Metacritic', 'value': '86/100'}]",Jennifer Kent,"A single mother and her child fall into a deep well of paranoia when an eerie children's book titled ""Mister Babadook"" manifests in their home.",The_Babadook.jpg
284,284,333,Hot Fuzz,2007,"Action, Comedy, Mystery","[{'source': 'Internet Movie Database', 'value': '7.8/10'}, {'source': 'Rotten Tomatoes', 'value': '91%'}, {'source': 'Metacritic', 'value': '81/100'}]",Edgar Wright,"An overachieving London police sergeant is transferred to a village where the easygoing officers object to his fervor for regulations, all while a string of grisly murders strikes the town.",Hot_Fuzz.jpg
285,285,334,Hellraiser,1987,"Horror, Thriller","[{'source': 'Internet Movie Database', 'value': '6.9/10'}, {'source': 'Rotten Tomatoes', 'value': '69%'}, {'source': 'Metacritic', 'value': '56/100'}]",Clive Barker,"A woman discovers the newly resurrected, partially formed, body of her brother-in-law and lover. She starts killing for him to revitalize his body and escape the demonic beings that are pursuing him after he escaped their underworld.",Hellraiser.jpg
286,286,335,Cars 3,2017,"Animation, Adventure, Comedy","[{'source': 'Internet Movie Database', 'value': '6.7/10'}, {'source': 'Rotten Tomatoes', 'value': '69%'}, {'source': 'Metacritic', 'value': '59/100'}]",Brian Fee,Lightning McQueen sets out to prove to a new generation of racers that he's still the best race car in the world.,Cars_3.jpg
287,287,337,The Others,2001,"Horror, Mystery, Thriller","[{'source': 'Internet Movie Database', 'value': '7.6/10'}, {'source': 'Rotten Tomatoes', 'value': '84%'}, {'source': 'Metacritic', 'value': '74/100'}]",Alejandro Amenábar,"In 1945, immediately following the end of Second World War, a woman who lives with her two photosensitive children on her darkened old family estate in the Channel Islands becomes convinced that the home is haunted.",The_Others.jpg
288,288,338,Sleepless in Seattle,1993,"Comedy, Drama, Romance","[{'source': 'Internet Movie Database', 'value': '6.8/10'}, {'source': 'Rotten Tomatoes', 'value': '75%'}, {'source': 'Metacritic', 'value': '72/100'}]",Nora Ephron,A recently widowed man's son calls a radio talk-show in an attempt to find his father a partner.,Sleepless_in_Seattle.jpg
289,289,339,Rosemary's Baby,1968,"Drama, Horror","[{'source': 'Internet Movie Database', 'value': '8.0/10'}, {'source': 'Rotten Tomatoes', 'value': '97%'}, {'source': 'Metacritic', 'value': '96/100'}]",Roman Polanski,"A young couple trying for a baby moves into an aging, ornate apartment building on Central Park West, where they find themselves surrounded by peculiar neighbors.",Rosemary's_Baby.jpg
290,290,340,Aladdin,1992,"Animation, Adventure, Comedy","[{'source': 'Internet Movie Database', 'value': '8.0/10'}, {'source': 'Rotten Tomatoes', 'value': '96%'}, {'source': 'Metacritic', 'value': '86/100'}]","Ron Clements, John Musker",A kind-hearted street urchin and a power-hungry Grand Vizier vie for a magic lamp that has the power to make their deepest wishes come true.,Aladdin.jpg
291,291,341,Forrest Gump,1994,"Drama, Romance","[{'source': 'Internet Movie Database', 'value': '8.8/10'}, {'source': 'Rotten Tomatoes', 'value': '75%'}, {'source': 'Metacritic', 'value': '82/100'}]",Robert Zemeckis,"The history of the United States from the 1950s to the '70s unfolds from the perspective of an Alabama man with an IQ of 75, who yearns to be reunited with his childhood sweetheart.",Forrest_Gump.jpg
292,292,342,Interstellar,2014,"Adventure, Drama, Sci-Fi","[{'source': 'Internet Movie Database', 'value': '8.7/10'}, {'source': 'Rotten Tomatoes', 'value': '73%'}, {'source': 'Metacritic', 'value': '74/100'}]",Christopher Nolan,"When Earth becomes uninhabitable in the future, a farmer and ex-NASA pilot, Joseph Cooper, is tasked to pilot a spacecraft, along with a team of researchers, to find a new planet for humans.",Interstellar.jpg
293,293,343,Lady and the Tramp,1955,"Animation, Adventure, Comedy","[{'source': 'Internet Movie Database', 'value': '7.3/10'}, {'source': 'Rotten Tomatoes', 'value': '93%'}, {'source': 'Metacritic', 'value': '78/100'}]","Clyde Geronimi, Wilfred Jackson, Hamilton Luske",The romantic tale of a sheltered uptown Cocker Spaniel dog and a streetwise downtown Mutt.,Lady_and_the_Tramp.jpg
294,294,344,The Matrix,1999,"Action, Sci-Fi","[{'source': 'Internet Movie Database', 'value': '8.7/10'}, {'source': 'Rotten Tomatoes', 'value': '83%'}, {'source': 'Metacritic', 'value': '73/100'}]","Lana Wachowski, Lilly Wachowski","When a beautiful stranger leads computer hacker Neo to a forbidding underworld, he discovers the shocking truth--the life he knows is the elaborate deception of an evil cyber-intelligence.",The_Matrix.jpg
295,295,345,The Brave Little Toaster,1987,"Animation, Adventure, Family","[{'source': 'Internet Movie Database', 'value': '7.2/10'}, {'source': 'Rotten Tomatoes', 'value': '79%'}]",Jerry Rees,A group of dated appliances embark on a journey to the city to find their master after being abandoned in a cabin in the woods.,The_Brave_Little_Toaster.jpg
296,296,346,The Black Stallion,1979,"Adventure, Family, Sport","[{'source': 'Internet Movie Database', 'value': '7.4/10'}, {'source': 'Rotten Tomatoes', 'value': '91%'}, {'source': 'Metacritic', 'value': '84/100'}]",Carroll Ballard,"After being shipwrecked with a magnificent horse off the coast of Africa in the 1940s, a boy bonds with the stallion, and trains him to race after their rescue.",The_Black_Stallion.jpg
297,297,347,Insurgent,2024,"Short, Western",[],Joe Lemieux,,Insurgent.jpg
298,298,348,Pretty Woman,1990,"Comedy, Romance","[{'source': 'Internet Movie Database', 'value': '7.1/10'}, {'source': 'Rotten Tomatoes', 'value': '64%'}, {'source': 'Metacritic', 'value': '51/100'}]",Garry Marshall,"Edward, a rich entrepreneur, hires Vivian, a prostitute, to accompany him to a few social events. Trouble ensues when he falls in love with her and they try to bridge the gap between their worlds.",Pretty_Woman.jpg
299,299,349,The Simpsons Movie,2007,"Animation, Adventure, Comedy","[{'source': 'Internet Movie Database', 'value': '7.3/10'}, {'source': 'Rotten Tomatoes', 'value': '87%'}, {'source': 'Metacritic', 'value': '80/100'}]",David Silverman,"After Homer pollutes the town's water supply, Springfield is encased in a gigantic dome by the EPA and the Simpsons are declared fugitives.",The_Simpsons_Movie.jpg
300,300,350,World War Z,2013,"Action, Adventure, Horror","[{'source': 'Internet Movie Database', 'value': '7.0/10'}, {'source': 'Rotten Tomatoes', 'value': '67%'}, {'source': 'Metacritic', 'value': '63/100'}]",Marc Forster,Former United Nations employee Gerry Lane traverses the world in a race against time to stop a zombie pandemic that is toppling armies and governments and threatens to destroy humanity itself.,World_War_Z.jpg
301,301,351,Bridget Jones's Diary,2001,"Comedy, Drama, Romance","[{'source': 'Internet Movie Database', 'value': '6.8/10'}, {'source': 'Rotten Tomatoes', 'value': '80%'}, {'source': 'Metacritic', 'value': '66/100'}]",Sharon Maguire,Bridget Jones is determined to improve herself while she looks for love in a year in which she keeps a personal diary.,Bridget_Jones's_Diary.jpg
302,302,352,Pet Sematary,1989,"Fantasy, Horror, Thriller","[{'source': 'Internet Movie Database', 'value': '6.5/10'}, {'source': 'Rotten Tomatoes', 'value': '58%'}, {'source': 'Metacritic', 'value': '38/100'}]",Mary Lambert,"After tragedy strikes, a grieving father discovers an ancient burial ground behind his home with the power to raise the dead.",Pet_Sematary.jpg
303,303,354,The Terminal,2004,"Comedy, Drama, Romance","[{'source': 'Internet Movie Database', 'value': '7.4/10'}, {'source': 'Rotten Tomatoes', 'value': '61%'}, {'source': 'Metacritic', 'value': '55/100'}]",Steven Spielberg,"An Eastern European tourist unexpectedly finds himself stranded in JFK airport, and must take up temporary residence there.",The_Terminal.jpg
304,304,355,Mamma Mia!,2008,"Comedy, Musical, Romance","[{'source': 'Internet Movie Database', 'value': '6.5/10'}, {'source': 'Rotten Tomatoes', 'value': '55%'}, {'source': 'Metacritic', 'value': '51/100'}]",Phyllida Lloyd,"Donna, an independent hotelier, is preparing for her daughter's wedding with the help of two old friends. Meanwhile Sophie, the spirited bride, has a plan. She invites three men from her mother's past in hope of meeting her real f...",Mamma_Mia!.jpg
305,305,356,The Return of Jafar,1994,"Animation, Adventure, Comedy, Family, Fantasy, Musical, Romance","[{'source': 'Internet Movie Database', 'value': '5.9/10'}, {'source': 'Rotten Tomatoes', 'value': '33%'}]","Toby Shelton, Tad Stones, Alan Zaslove","Jafar comes for revenge on Aladdin, using a foolish thief and Iago's treachery to find a way back into power.",The_Return_of_Jafar.jpg
306,306,357,Donnie Brasco,1997,"Biography, Crime, Drama","[{'source': 'Internet Movie Database', 'value': '7.7/10'}, {'source': 'Rotten Tomatoes', 'value': '88%'}, {'source': 'Metacritic', 'value': '77/100'}]",Mike Newell,An FBI undercover agent infiltrates the mob and finds himself identifying more with the Mafia life--at the expense of his regular one.,Donnie_Brasco.jpg
307,307,359,The Pianist,2002,"Biography, Drama, Music","[{'source': 'Internet Movie Database', 'value': '8.5/10'}, {'source': 'Rotten Tomatoes', 'value': '95%'}, {'source': 'Metacritic', 'value': '85/100'}]",Roman Polanski,"During WWII, acclaimed Polish musician Wladyslaw faces various struggles as he loses contact with his family. As the situation worsens, he hides in the ruins of Warsaw in order to survive.",The_Pianist.jpg
308,308,360,Trolls,2016,"Animation, Adventure, Comedy","[{'source': 'Internet Movie Database', 'value': '6.4/10'}, {'source': 'Rotten Tomatoes', 'value': '76%'}, {'source': 'Metacritic', 'value': '55/100'}]","Mike Mitchell, Walt Dohrn","After the Bergens invade Troll Village, Poppy, the happiest Troll ever born, and the curmudgeonly Branch set off on a journey to rescue her friends.",Trolls.jpg
309,309,361,House of 1000 Corpses,2003,Horror,"[{'source': 'Internet Movie Database', 'value': '6.0/10'}, {'source': 'Rotten Tomatoes', 'value': '21%'}, {'source': 'Metacritic', 'value': '31/100'}]",Rob Zombie,Two young couples traveling across the backwoods of Texas searching for urban legends of murder end up as prisoners of a bizarre and sadistic backwater family of serial killers.,House_of_1000_Corpses.jpg
310,310,362,Jumanji,1995,"Adventure, Comedy, Family","[{'source': 'Internet Movie Database', 'value': '7.1/10'}, {'source': 'Rotten Tomatoes', 'value': '52%'}, {'source': 'Metacritic', 'value': '39/100'}]",Joe Johnston,"When two kids find and play a magical board game, they release a man trapped in it for decades - and a host of dangers that can only be stopped by finishing the game.",Jumanji.jpg
311,311,363,Django Unchained,2012,"Comedy, Drama, Western","[{'source': 'Internet Movie Database', 'value': '8.5/10'}, {'source': 'Rotten Tomatoes', 'value': '87%'}, {'source': 'Metacritic', 'value': '81/100'}]",Quentin Tarantino,"With the help of a German bounty-hunter, a freed slave sets out to rescue his wife from a brutal plantation owner in Mississippi.",Django_Unchained.jpg
312,312,364,I Am Legend,2007,"Drama, Horror, Sci-Fi","[{'source': 'Internet Movie Database', 'value': '7.2/10'}, {'source': 'Rotten Tomatoes', 'value': '68%'}, {'source': 'Metacritic', 'value': '65/100'}]",Francis Lawrence,"Years after a plague kills most of humanity and transforms the rest into monsters, the sole survivor in New York City struggles valiantly to find a cure.",I_Am_Legend.jpg
313,313,365,The Black Cauldron,1985,"Animation, Action, Adventure","[{'source': 'Internet Movie Database', 'value': '6.3/10'}, {'source': 'Rotten Tomatoes', 'value': '56%'}, {'source': 'Metacritic', 'value': '59/100'}]","Ted Berman, Richard Rich",A young boy and a group of misfit friends embark on a quest to find a dark magic item of ultimate power before a diabolical tyrant can.,The_Black_Cauldron.jpg
314,314,366,"Monsters, Inc.",2001,"Animation, Adventure, Comedy","[{'source': 'Internet Movie Database', 'value': '8.1/10'}, {'source': 'Rotten Tomatoes', 'value': '96%'}, {'source': 'Metacritic', 'value': '79/100'}]","Pete Docter, David Silverman, Lee Unkrich","In order to power the city, monsters have to scare children so that they scream. However, the children are toxic to the monsters, and after a child gets through, two monsters realize things may not be what they think.","Monsters,_Inc..jpg"
