title,year,user_tags,reviews,author,plot,poster
Aardvark,2017,Drama,"[{'source': 'Internet Movie Database', 'value': '4.5/10'}, {'source': 'Rotten Tomatoes', 'value': '8%'}, {'source': 'Metacritic', 'value': '37/100'}]",Brian Shoaf,The aardvark has evolved to be one of a kind. You could say the same of Josh Norman.,Aardvark.jpg
The Walking Dead,2010–2022,"Drama, Horror, Thriller","[{'source': 'Internet Movie Database', 'value': '8.1/10'}]",N/A,Sheriff Deputy Rick Grimes wakes up from a coma to learn the world is in ruins and must lead a group of survivors to stay alive.,The_Walking_Dead.jpg
It Comes at Night,2017,"Drama, Horror, Mystery","[{'source': 'Internet Movie Database', 'value': '6.1/10'}, {'source': 'Rotten Tomatoes', 'value': '87%'}, {'source': 'Metacritic', 'value': '78/100'}]",Trey Edward Shults,"Secure within a desolate home as an unnatural threat terrorizes the world, a man has established a tenuous domestic order with his wife and son. Then a desperate young family arrives seeking refuge.",It_Comes_at_Night.jpg
Shutter Island,2010,"Drama, Mystery, Thriller","[{'source': 'Internet Movie Database', 'value': '8.2/10'}, {'source': 'Rotten Tomatoes', 'value': '69%'}, {'source': 'Metacritic', 'value': '63/100'}]",Martin Scorsese,Two US marshals are sent to a mental institution on an inhospitable island in order to investigate the disappearance of a patient.,Shutter_Island.jpg
Toy Story 2,1999,"Animation, Adventure, Comedy","[{'source': 'Internet Movie Database', 'value': '7.9/10'}, {'source': 'Rotten Tomatoes', 'value': '100%'}, {'source': 'Metacritic', 'value': '88/100'}]","John Lasseter, Ash Brannon, Lee Unkrich","When Woody is stolen by a toy collector, Buzz and his friends set out on a rescue mission to save Woody before he becomes a museum toy property with his roundup gang Jessie, Prospector, and Bullseye.",Toy_Story_2.jpg
Sin City,2005,"Crime, Thriller","[{'source': 'Internet Movie Database', 'value': '8.0/10'}, {'source': 'Rotten Tomatoes', 'value': '76%'}, {'source': 'Metacritic', 'value': '74/100'}]","Frank Miller, Quentin Tarantino, Robert Rodriguez","An exploration of the dark and miserable Basin City and three of its residents, all of whom are caught up in violent corruption.",Sin_City.jpg
Tucker & Dale vs Evil (2010),2010,N/A,"[{'source': 'Rotten Tomatoes', 'value': '86%'}]",N/A,N/A,Tucker_&_Dale_vs._Evil.jpg
The Theory of Everything,2014,"Biography, Drama, Romance","[{'source': 'Internet Movie Database', 'value': '7.7/10'}, {'source': 'Rotten Tomatoes', 'value': '81%'}, {'source': 'Metacritic', 'value': '71/100'}]",James Marsh,Stephen Hawking gets unprecedented success in the field of physics despite being diagnosed with motor neuron disease at the age of 21. He defeats awful odds as his first wife Jane aids him loyally.,The_Theory_of_Everything.jpg
RiffTrax: Star Wars: The Rise of Skywalker,2020,"Comedy, Sci-Fi",[],N/A,"Ever since the original premiered in 1977, Star Wars fans have waited to see how the Skywalker saga would end.",Star_Wars:_The_Rise_of_Skywalker.jpg
Elf,2003,"Adventure, Comedy, Family","[{'source': 'Internet Movie Database', 'value': '7.1/10'}, {'source': 'Rotten Tomatoes', 'value': '86%'}, {'source': 'Metacritic', 'value': '66/100'}]",Jon Favreau,"Raised as an oversized elf, Buddy travels from the North Pole to New York City to meet his biological father, Walter Hobbs, who doesn't know he exists and is in desperate need of some Christmas spirit.",Elf.jpg
The Avengers,2012,"Action, Sci-Fi","[{'source': 'Internet Movie Database', 'value': '8.0/10'}, {'source': 'Rotten Tomatoes', 'value': '91%'}, {'source': 'Metacritic', 'value': '69/100'}]",Joss Whedon,Earth's mightiest heroes must come together and learn to fight as a team if they are going to stop the mischievous Loki and his alien army from enslaving humanity.,The_Avengers.jpg
Iron Man 3,2013,"Action, Adventure, Sci-Fi","[{'source': 'Internet Movie Database', 'value': '7.1/10'}, {'source': 'Rotten Tomatoes', 'value': '79%'}, {'source': 'Metacritic', 'value': '62/100'}]",Shane Black,"When Tony Stark's world is torn apart by a formidable terrorist called the Mandarin, he starts an odyssey of rebuilding and retribution.",Iron_Man_3.jpg
The Green Mile,1999,"Crime, Drama, Fantasy","[{'source': 'Internet Movie Database', 'value': '8.6/10'}, {'source': 'Rotten Tomatoes', 'value': '79%'}, {'source': 'Metacritic', 'value': '61/100'}]",Frank Darabont,"Paul Edgecomb, the head guard of a prison, meets an inmate, John Coffey, a black man who is accused of murdering two girls. His life changes drastically when he discovers that John has a special gift.",The_Green_Mile.jpg
Spider-Man 2,2004,"Action, Adventure, Sci-Fi","[{'source': 'Internet Movie Database', 'value': '7.5/10'}, {'source': 'Rotten Tomatoes', 'value': '93%'}, {'source': 'Metacritic', 'value': '83/100'}]",Sam Raimi,Peter Parker is beset with troubles in his failing personal life as he battles a former brilliant scientist named Otto Octavius.,Spider-Man_2.jpg
Dumbo,1941,"Animation, Adventure, Drama","[{'source': 'Internet Movie Database', 'value': '7.2/10'}, {'source': 'Rotten Tomatoes', 'value': '95%'}, {'source': 'Metacritic', 'value': '96/100'}]","Samuel Armstrong, Norman Ferguson, Wilfred Jackson","Ridiculed because of his enormous ears, a young circus elephant is assisted by a mouse to achieve his full potential.",Dumbo.jpg
Paranormal Activity,2007,"Horror, Mystery","[{'source': 'Internet Movie Database', 'value': '6.3/10'}, {'source': 'Rotten Tomatoes', 'value': '83%'}, {'source': 'Metacritic', 'value': '68/100'}]",Oren Peli,"After moving into a suburban home, a couple becomes increasingly disturbed by a nightly demonic presence.",Paranormal_Activity.jpg
Iron Man,2008,"Action, Adventure, Sci-Fi","[{'source': 'Internet Movie Database', 'value': '7.9/10'}, {'source': 'Rotten Tomatoes', 'value': '94%'}, {'source': 'Metacritic', 'value': '79/100'}]",Jon Favreau,"After being held captive in an Afghan cave, billionaire engineer Tony Stark creates a unique weaponized suit of armor to fight evil.",Iron_Man.jpg
The Grand Budapest Hotel,2014,"Adventure, Comedy, Crime","[{'source': 'Internet Movie Database', 'value': '8.1/10'}, {'source': 'Rotten Tomatoes', 'value': '92%'}, {'source': 'Metacritic', 'value': '88/100'}]",Wes Anderson,"A writer encounters the owner of an aging high-class hotel, who tells him of his early years serving as a lobby boy in the hotel's glorious years under an exceptional concierge.",The_Grand_Budapest_Hotel.jpg
X-Men: The Last Stand,2006,"Action, Adventure, Sci-Fi","[{'source': 'Internet Movie Database', 'value': '6.6/10'}, {'source': 'Rotten Tomatoes', 'value': '56%'}, {'source': 'Metacritic', 'value': '58/100'}]",Brett Ratner,"The human government develops a cure for mutations, and Jean Grey becomes a darker uncontrollable persona called the Phoenix who allies with Magneto, causing escalation into an all-out battle for the X-Men.",X-Men:_The_Last_Stand.jpg
Wallace & Gromit: The Curse of the Were-Rabbit,2005,"Animation, Adventure, Comedy","[{'source': 'Internet Movie Database', 'value': '7.5/10'}, {'source': 'Rotten Tomatoes', 'value': '95%'}, {'source': 'Metacritic', 'value': '87/100'}]","Steve Box, Nick Park","Wallace and his loyal dog, Gromit, set out to discover the mystery behind the garden sabotage that plagues their village and threatens the annual giant vegetable growing contest.",Wallace_&_Gromit:_The_Curse_of_the_Were-Rabbit.jpg
The Babadook,2014,"Drama, Horror, Mystery","[{'source': 'Internet Movie Database', 'value': '6.8/10'}, {'source': 'Rotten Tomatoes', 'value': '98%'}, {'source': 'Metacritic', 'value': '86/100'}]",Jennifer Kent,"A single mother and her child fall into a deep well of paranoia when an eerie children's book titled ""Mister Babadook"" manifests in their home.",The_Babadook.jpg
Hot Fuzz,2007,"Action, Comedy, Mystery","[{'source': 'Internet Movie Database', 'value': '7.8/10'}, {'source': 'Rotten Tomatoes', 'value': '91%'}, {'source': 'Metacritic', 'value': '81/100'}]",Edgar Wright,"An overachieving London police sergeant is transferred to a village where the easygoing officers object to his fervor for regulations, all while a string of grisly murders strikes the town.",Hot_Fuzz.jpg
Hellraiser,1987,"Horror, Thriller","[{'source': 'Internet Movie Database', 'value': '6.9/10'}, {'source': 'Rotten Tomatoes', 'value': '69%'}, {'source': 'Metacritic', 'value': '56/100'}]",Clive Barker,"A woman discovers the newly resurrected, partially formed, body of her brother-in-law and lover. She starts killing for him to revitalize his body and escape the demonic beings that are pursuing him after he escaped their underworld.",Hellraiser.jpg
Cars 3,2017,"Animation, Adventure, Comedy","[{'source': 'Internet Movie Database', 'value': '6.7/10'}, {'source': 'Rotten Tomatoes', 'value': '69%'}, {'source': 'Metacritic', 'value': '59/100'}]",Brian Fee,Lightning McQueen sets out to prove to a new generation of racers that he's still the best race car in the world.,Cars_3.jpg
The Hunger Games: Catching Fire,2013,"Action, Adventure, Sci-Fi","[{'source': 'Internet Movie Database', 'value': '7.5/10'}, {'source': 'Rotten Tomatoes', 'value': '90%'}, {'source': 'Metacritic', 'value': '76/100'}]",Francis Lawrence,Katniss Everdeen and Peeta Mellark become targets of the Capitol after their victory in the 74th Hunger Games sparks a rebellion in the Districts of Panem.,The_Hunger_Games:_Catching_Fire.jpg
The Others,2001,"Horror, Mystery, Thriller","[{'source': 'Internet Movie Database', 'value': '7.6/10'}, {'source': 'Rotten Tomatoes', 'value': '84%'}, {'source': 'Metacritic', 'value': '74/100'}]",Alejandro Amenábar,"In 1945, immediately following the end of Second World War, a woman who lives with her two photosensitive children on her darkened old family estate in the Channel Islands becomes convinced that the home is haunted.",The_Others.jpg
Sleepless in Seattle,1993,"Comedy, Drama, Romance","[{'source': 'Internet Movie Database', 'value': '6.8/10'}, {'source': 'Rotten Tomatoes', 'value': '75%'}, {'source': 'Metacritic', 'value': '72/100'}]",Nora Ephron,A recently widowed man's son calls a radio talk-show in an attempt to find his father a partner.,Sleepless_in_Seattle.jpg
Rosemary's Baby,1968,"Drama, Horror","[{'source': 'Internet Movie Database', 'value': '8.0/10'}, {'source': 'Rotten Tomatoes', 'value': '97%'}, {'source': 'Metacritic', 'value': '96/100'}]",Roman Polanski,"A young couple trying for a baby moves into an aging, ornate apartment building on Central Park West, where they find themselves surrounded by peculiar neighbors.",Rosemary's_Baby.jpg
Aladdin,1992,"Animation, Adventure, Comedy","[{'source': 'Internet Movie Database', 'value': '8.0/10'}, {'source': 'Rotten Tomatoes', 'value': '96%'}, {'source': 'Metacritic', 'value': '86/100'}]","Ron Clements, John Musker",A kind-hearted street urchin and a power-hungry Grand Vizier vie for a magic lamp that has the power to make their deepest wishes come true.,Aladdin.jpg
Forrest Gump,1994,"Drama, Romance","[{'source': 'Internet Movie Database', 'value': '8.8/10'}, {'source': 'Rotten Tomatoes', 'value': '75%'}, {'source': 'Metacritic', 'value': '82/100'}]",Robert Zemeckis,"The history of the United States from the 1950s to the '70s unfolds from the perspective of an Alabama man with an IQ of 75, who yearns to be reunited with his childhood sweetheart.",Forrest_Gump.jpg
Interstellar,2014,"Adventure, Drama, Sci-Fi","[{'source': 'Internet Movie Database', 'value': '8.7/10'}, {'source': 'Rotten Tomatoes', 'value': '73%'}, {'source': 'Metacritic', 'value': '74/100'}]",Christopher Nolan,"When Earth becomes uninhabitable in the future, a farmer and ex-NASA pilot, Joseph Cooper, is tasked to pilot a spacecraft, along with a team of researchers, to find a new planet for humans.",Interstellar.jpg
Lady and the Tramp,1955,"Animation, Adventure, Comedy","[{'source': 'Internet Movie Database', 'value': '7.3/10'}, {'source': 'Rotten Tomatoes', 'value': '93%'}, {'source': 'Metacritic', 'value': '78/100'}]","Clyde Geronimi, Wilfred Jackson, Hamilton Luske",The romantic tale of a sheltered uptown Cocker Spaniel dog and a streetwise downtown Mutt.,Lady_and_the_Tramp.jpg
The Matrix,1999,"Action, Sci-Fi","[{'source': 'Internet Movie Database', 'value': '8.7/10'}, {'source': 'Rotten Tomatoes', 'value': '83%'}, {'source': 'Metacritic', 'value': '73/100'}]","Lana Wachowski, Lilly Wachowski","When a beautiful stranger leads computer hacker Neo to a forbidding underworld, he discovers the shocking truth--the life he knows is the elaborate deception of an evil cyber-intelligence.",The_Matrix.jpg
The Brave Little Toaster,1987,"Animation, Adventure, Family","[{'source': 'Internet Movie Database', 'value': '7.2/10'}, {'source': 'Rotten Tomatoes', 'value': '79%'}]",Jerry Rees,A group of dated appliances embark on a journey to the city to find their master after being abandoned in a cabin in the woods.,The_Brave_Little_Toaster.jpg
The Black Stallion,1979,"Adventure, Family, Sport","[{'source': 'Internet Movie Database', 'value': '7.4/10'}, {'source': 'Rotten Tomatoes', 'value': '91%'}, {'source': 'Metacritic', 'value': '84/100'}]",Carroll Ballard,"After being shipwrecked with a magnificent horse off the coast of Africa in the 1940s, a boy bonds with the stallion, and trains him to race after their rescue.",The_Black_Stallion.jpg
Insurgent,2024,"Short, Western",[],Joe Lemieux,N/A,Insurgent.jpg
Pretty Woman,1990,"Comedy, Romance","[{'source': 'Internet Movie Database', 'value': '7.1/10'}, {'source': 'Rotten Tomatoes', 'value': '64%'}, {'source': 'Metacritic', 'value': '51/100'}]",Garry Marshall,"Edward, a rich entrepreneur, hires Vivian, a prostitute, to accompany him to a few social events. Trouble ensues when he falls in love with her and they try to bridge the gap between their worlds.",Pretty_Woman.jpg
The Simpsons Movie,2007,"Animation, Adventure, Comedy","[{'source': 'Internet Movie Database', 'value': '7.3/10'}, {'source': 'Rotten Tomatoes', 'value': '87%'}, {'source': 'Metacritic', 'value': '80/100'}]",David Silverman,"After Homer pollutes the town's water supply, Springfield is encased in a gigantic dome by the EPA and the Simpsons are declared fugitives.",The_Simpsons_Movie.jpg
World War Z,2013,"Action, Adventure, Horror","[{'source': 'Internet Movie Database', 'value': '7.0/10'}, {'source': 'Rotten Tomatoes', 'value': '67%'}, {'source': 'Metacritic', 'value': '63/100'}]",Marc Forster,Former United Nations employee Gerry Lane traverses the world in a race against time to stop a zombie pandemic that is toppling armies and governments and threatens to destroy humanity itself.,World_War_Z.jpg
Bridget Jones's Diary,2001,"Comedy, Drama, Romance","[{'source': 'Internet Movie Database', 'value': '6.8/10'}, {'source': 'Rotten Tomatoes', 'value': '80%'}, {'source': 'Metacritic', 'value': '66/100'}]",Sharon Maguire,Bridget Jones is determined to improve herself while she looks for love in a year in which she keeps a personal diary.,Bridget_Jones's_Diary.jpg
Pet Sematary,1989,"Fantasy, Horror, Thriller","[{'source': 'Internet Movie Database', 'value': '6.5/10'}, {'source': 'Rotten Tomatoes', 'value': '58%'}, {'source': 'Metacritic', 'value': '38/100'}]",Mary Lambert,"After tragedy strikes, a grieving father discovers an ancient burial ground behind his home with the power to raise the dead.",Pet_Sematary.jpg
Mad Max: Fury Road,2015,"Action, Adventure, Sci-Fi","[{'source': 'Internet Movie Database', 'value': '8.1/10'}, {'source': 'Rotten Tomatoes', 'value': '97%'}, {'source': 'Metacritic', 'value': '90/100'}]",George Miller,"In a post-apocalyptic wasteland, a woman rebels against a tyrannical ruler in search for her homeland with the aid of a group of female prisoners, a psychotic worshipper and a drifter named Max.",Mad_Max:_Fury_Road.jpg
The Terminal,2004,"Comedy, Drama, Romance","[{'source': 'Internet Movie Database', 'value': '7.4/10'}, {'source': 'Rotten Tomatoes', 'value': '61%'}, {'source': 'Metacritic', 'value': '55/100'}]",Steven Spielberg,"An Eastern European tourist unexpectedly finds himself stranded in JFK airport, and must take up temporary residence there.",The_Terminal.jpg
Mamma Mia!,2008,"Comedy, Musical, Romance","[{'source': 'Internet Movie Database', 'value': '6.5/10'}, {'source': 'Rotten Tomatoes', 'value': '55%'}, {'source': 'Metacritic', 'value': '51/100'}]",Phyllida Lloyd,"Donna, an independent hotelier, is preparing for her daughter's wedding with the help of two old friends. Meanwhile Sophie, the spirited bride, has a plan. She invites three men from her mother's past in hope of meeting her real f...",Mamma_Mia!.jpg
The Return of Jafar,1994,"Animation, Adventure, Comedy, Family, Fantasy, Musical, Romance","[{'source': 'Internet Movie Database', 'value': '5.9/10'}, {'source': 'Rotten Tomatoes', 'value': '33%'}]","Toby Shelton, Tad Stones, Alan Zaslove","Jafar comes for revenge on Aladdin, using a foolish thief and Iago's treachery to find a way back into power.",The_Return_of_Jafar.jpg
Donnie Brasco,1997,"Biography, Crime, Drama","[{'source': 'Internet Movie Database', 'value': '7.7/10'}, {'source': 'Rotten Tomatoes', 'value': '88%'}, {'source': 'Metacritic', 'value': '77/100'}]",Mike Newell,An FBI undercover agent infiltrates the mob and finds himself identifying more with the Mafia life--at the expense of his regular one.,Donnie_Brasco.jpg
Spider-Man: Into the Spider-Verse,2018,"Animation, Action, Adventure","[{'source': 'Internet Movie Database', 'value': '8.4/10'}, {'source': 'Rotten Tomatoes', 'value': '97%'}, {'source': 'Metacritic', 'value': '87/100'}]","Bob Persichetti, Peter Ramsey, Rodney Rothman",Teen Miles Morales becomes the Spider-Man of his universe and must join with five spider-powered individuals from other dimensions to stop a threat for all realities.,Spider-Man:_Into_the_Spider-Verse.jpg
The Pianist,2002,"Biography, Drama, Music","[{'source': 'Internet Movie Database', 'value': '8.5/10'}, {'source': 'Rotten Tomatoes', 'value': '95%'}, {'source': 'Metacritic', 'value': '85/100'}]",Roman Polanski,"During WWII, acclaimed Polish musician Wladyslaw faces various struggles as he loses contact with his family. As the situation worsens, he hides in the ruins of Warsaw in order to survive.",The_Pianist.jpg
Trolls,2016,"Animation, Adventure, Comedy","[{'source': 'Internet Movie Database', 'value': '6.4/10'}, {'source': 'Rotten Tomatoes', 'value': '76%'}, {'source': 'Metacritic', 'value': '55/100'}]","Mike Mitchell, Walt Dohrn","After the Bergens invade Troll Village, Poppy, the happiest Troll ever born, and the curmudgeonly Branch set off on a journey to rescue her friends.",Trolls.jpg
House of 1000 Corpses,2003,Horror,"[{'source': 'Internet Movie Database', 'value': '6.0/10'}, {'source': 'Rotten Tomatoes', 'value': '21%'}, {'source': 'Metacritic', 'value': '31/100'}]",Rob Zombie,Two young couples traveling across the backwoods of Texas searching for urban legends of murder end up as prisoners of a bizarre and sadistic backwater family of serial killers.,House_of_1000_Corpses.jpg
Jumanji,1995,"Adventure, Comedy, Family","[{'source': 'Internet Movie Database', 'value': '7.1/10'}, {'source': 'Rotten Tomatoes', 'value': '52%'}, {'source': 'Metacritic', 'value': '39/100'}]",Joe Johnston,"When two kids find and play a magical board game, they release a man trapped in it for decades - and a host of dangers that can only be stopped by finishing the game.",Jumanji.jpg
Django Unchained,2012,"Comedy, Drama, Western","[{'source': 'Internet Movie Database', 'value': '8.5/10'}, {'source': 'Rotten Tomatoes', 'value': '87%'}, {'source': 'Metacritic', 'value': '81/100'}]",Quentin Tarantino,"With the help of a German bounty-hunter, a freed slave sets out to rescue his wife from a brutal plantation owner in Mississippi.",Django_Unchained.jpg
I Am Legend,2007,"Drama, Horror, Sci-Fi","[{'source': 'Internet Movie Database', 'value': '7.2/10'}, {'source': 'Rotten Tomatoes', 'value': '68%'}, {'source': 'Metacritic', 'value': '65/100'}]",Francis Lawrence,"Years after a plague kills most of humanity and transforms the rest into monsters, the sole survivor in New York City struggles valiantly to find a cure.",I_Am_Legend.jpg
The Black Cauldron,1985,"Animation, Action, Adventure","[{'source': 'Internet Movie Database', 'value': '6.3/10'}, {'source': 'Rotten Tomatoes', 'value': '56%'}, {'source': 'Metacritic', 'value': '59/100'}]","Ted Berman, Richard Rich",A young boy and a group of misfit friends embark on a quest to find a dark magic item of ultimate power before a diabolical tyrant can.,The_Black_Cauldron.jpg
"Monsters, Inc.",2001,"Animation, Adventure, Comedy","[{'source': 'Internet Movie Database', 'value': '8.1/10'}, {'source': 'Rotten Tomatoes', 'value': '96%'}, {'source': 'Metacritic', 'value': '79/100'}]","Pete Docter, David Silverman, Lee Unkrich","In order to power the city, monsters have to scare children so that they scream. However, the children are toxic to the monsters, and after a child gets through, two monsters realize things may not be what they think.","Monsters,_Inc..jpg"
Back to the Future Part III,1990,"Adventure, Comedy, Sci-Fi","[{'source': 'Internet Movie Database', 'value': '7.4/10'}, {'source': 'Rotten Tomatoes', 'value': '79%'}, {'source': 'Metacritic', 'value': '55/100'}]",Robert Zemeckis,"Stranded in 1955, Marty McFly learns about the death of Doc Brown in 1885 and must travel back in time to save him. With no fuel readily available for the DeLorean, the two must figure how to escape the Old West before Emmett is m...",Back_to_the_Future_Part_III.jpg
The Angry Birds Movie,2016,"Animation, Action, Adventure","[{'source': 'Internet Movie Database', 'value': '6.3/10'}, {'source': 'Rotten Tomatoes', 'value': '44%'}, {'source': 'Metacritic', 'value': '43/100'}]","Clay Kaytis, Fergal Reilly","When an island populated by happy, flightless birds is visited by mysterious green pigs, it's up to three unlikely outcasts to figure out what the pigs are up to.",The_Angry_Birds_Movie.jpg
Pirates of the Caribbean: Dead Man's Chest,2006,"Action, Adventure, Fantasy","[{'source': 'Internet Movie Database', 'value': '7.4/10'}, {'source': 'Rotten Tomatoes', 'value': '53%'}, {'source': 'Metacritic', 'value': '53/100'}]",Gore Verbinski,"Jack Sparrow races to recover the heart of Davy Jones to avoid enslaving his soul to Jones' service, as other friends and foes seek the heart for their own agenda as well.",Pirates_of_the_Caribbean:_Dead_Man's_Chest.jpg
The Lego Ninjago Movie,2017,"Animation, Adventure, Comedy","[{'source': 'Internet Movie Database', 'value': '6.1/10'}, {'source': 'Rotten Tomatoes', 'value': '56%'}, {'source': 'Metacritic', 'value': '55/100'}]","Charlie Bean, Paul Fisher, Bob Logan","Shunned by everyone for being the son of an evil warlord, a teenager seeks to defeat him with the help of his fellow ninjas.",The_Lego_Ninjago_Movie.jpg
Shark Tale,2004,"Animation, Adventure, Comedy","[{'source': 'Internet Movie Database', 'value': '6.0/10'}, {'source': 'Rotten Tomatoes', 'value': '35%'}, {'source': 'Metacritic', 'value': '48/100'}]","Bibo Bergeron, Vicky Jenson, Rob Letterman","When a son of a gangster shark boss is accidentally killed while on the hunt, his would-be prey and his vegetarian brother decide to use the incident to their own advantage.",Shark_Tale.jpg
Suicide Squad,2016,"Action, Adventure, Fantasy","[{'source': 'Internet Movie Database', 'value': '5.9/10'}, {'source': 'Rotten Tomatoes', 'value': '26%'}, {'source': 'Metacritic', 'value': '40/100'}]",David Ayer,A secret government agency recruits some of the most dangerous incarcerated super-villains to form a defensive task force. Their first mission: save the world from the apocalypse.,Suicide_Squad.jpg
Sinister 2,2015,"Horror, Mystery, Thriller","[{'source': 'Internet Movie Database', 'value': '5.3/10'}, {'source': 'Rotten Tomatoes', 'value': '14%'}, {'source': 'Metacritic', 'value': '32/100'}]",Ciarán Foy,A young mother and her twin sons move into a rural house that's marked for death.,Sinister_2.jpg
The Making of Madagascar 2,2008,Documentary,"[{'source': 'Internet Movie Database', 'value': '6.1/10'}]",N/A,N/A,N/A
Halloween,1978,"Horror, Thriller","[{'source': 'Internet Movie Database', 'value': '7.7/10'}, {'source': 'Rotten Tomatoes', 'value': '97%'}, {'source': 'Metacritic', 'value': '90/100'}]",John Carpenter,"Fifteen years after murdering his sister on Halloween night 1963, Michael Myers escapes from a mental hospital and returns to the small town of Haddonfield, Illinois, to kill again.",Halloween.jpg
Birdman,1967–1987,"Animation, Action, Adventure","[{'source': 'Internet Movie Database', 'value': '6.7/10'}]",N/A,A winged superhero who gets his powers from the sun battles various evildoers with the help of his eagle sidekick Avenger.,Birdman.jpg
The Ultimate 'Star Wars: A New Hope' Recap Cartoon,2020,"Animation, Short, Comedy",[],"Junaid Chundrigar, Cas van de Pol","You'll relive Luke's Tatooine beginnings, join Han Solo's smuggler shenanigans, and witness Leia's princess power, all with a healthy dose of silliness. Lightsabers become oversized pool noodles, the Death Star explodes in a confe...",Star_Wars:_A_New_Hope.jpg
The Ultimate 'WALL-E' Recap Cartoon,2022,"Animation, Short",[],"Brian Bear, Cas van de Pol",N/A,Wall-E.jpg
Se7en,1995,"Crime, Drama, Mystery","[{'source': 'Internet Movie Database', 'value': '8.6/10'}, {'source': 'Rotten Tomatoes', 'value': '84%'}, {'source': 'Metacritic', 'value': '65/100'}]",David Fincher,"Two detectives, a rookie and a veteran, hunt a serial killer who uses the seven deadly sins as his motives.",Se7en.jpg
