title,year,user_tags,reviews,author,plot,poster
The Hateful Eight,2015,"Crime, Drama, Mystery","[{'source': 'Internet Movie Database', 'value': '7.8/10'}, {'source': 'Rotten Tomatoes', 'value': '74%'}, {'source': 'Metacritic', 'value': '68/100'}]",Quentin Tarantino,"In the dead of a Wyoming winter, a bounty hunter and his prisoner find shelter in a cabin currently inhabited by a collection of nefarious characters.",The_Hateful_Eight.jpg
Up,2009,"Animation, Adventure, Comedy","[{'source': 'Internet Movie Database', 'value': '8.3/10'}, {'source': 'Rotten Tomatoes', 'value': '98%'}, {'source': 'Metacritic', 'value': '88/100'}]","Pete Docter, Bob Peterson","78-year-old Carl Fredricksen travels to South America in his house equipped with balloons, inadvertently taking a young stowaway.",Up.jpg
The Sword in the Stone,1963,"Animation, Adventure, Comedy","[{'source': 'Internet Movie Database', 'value': '7.1/10'}, {'source': 'Rotten Tomatoes', 'value': '66%'}, {'source': 'Metacritic', 'value': '61/100'}]","Wolfgang Reitherman, Clyde Geronimi, David Hand","A poor boy named Arthur learns the power of love, kindness, knowledge and bravery with the help of a wizard called Merlin in the path to become one of the most beloved kings in English history.",The_Sword_in_the_Stone.jpg
The Borrowers,1997,"Adventure, Comedy, Family","[{'source': 'Internet Movie Database', 'value': '5.9/10'}, {'source': 'Rotten Tomatoes', 'value': '75%'}]",Peter Hewitt,A secret family of four-inch people living inside the walls of a house must save their home from an evil real estate developer.,The_Borrowers.jpg
Her,2013,"Drama, Romance, Sci-Fi","[{'source': 'Internet Movie Database', 'value': '8.0/10'}, {'source': 'Rotten Tomatoes', 'value': '95%'}, {'source': 'Metacritic', 'value': '91/100'}]",Spike Jonze,"In the near future, a lonely writer develops an unlikely relationship with an operating system designed to meet his every need.",Her.jpg
Madagascar 3: Europe's Most Wanted,2012,"Animation, Adventure, Comedy","[{'source': 'Internet Movie Database', 'value': '6.8/10'}, {'source': 'Rotten Tomatoes', 'value': '78%'}, {'source': 'Metacritic', 'value': '60/100'}]","Eric Darnell, Tom McGrath, Conrad Vernon","The Madagascar animals join a struggling European circus to get back to New York, but find themselves being pursued by a psychotic animal-control officer.",Madagascar_3.jpg
Sing 2,2021,"Animation, Adventure, Comedy","[{'source': 'Internet Movie Database', 'value': '7.3/10'}, {'source': 'Rotten Tomatoes', 'value': '72%'}, {'source': 'Metacritic', 'value': '49/100'}]","Garth Jennings, Christophe Lourdelet",Buster Moon and his friends must persuade reclusive rock star Clay Calloway to join them for the opening of a new show.,Sing_2.jpg
Divergent,2014,"Action, Adventure, Mystery","[{'source': 'Internet Movie Database', 'value': '6.6/10'}, {'source': 'Rotten Tomatoes', 'value': '41%'}, {'source': 'Metacritic', 'value': '48/100'}]",Neil Burger,"In a world divided by factions based on virtues, Tris learns she's Divergent and won't fit in. When she discovers a plot to destroy Divergents, Tris and the mysterious Four must find out what makes Divergents dangerous before it's...",Divergent.jpg
Annabelle,2014,"Horror, Mystery, Thriller","[{'source': 'Internet Movie Database', 'value': '5.5/10'}, {'source': 'Rotten Tomatoes', 'value': '28%'}, {'source': 'Metacritic', 'value': '37/100'}]",John R. Leonetti,A couple begins to experience terrifying supernatural occurrences involving a vintage doll shortly after their home is invaded by satanic cultists.,Annabelle.jpg
Elektra,2005,"Action, Adventure, Crime","[{'source': 'Internet Movie Database', 'value': '4.7/10'}, {'source': 'Rotten Tomatoes', 'value': '11%'}, {'source': 'Metacritic', 'value': '34/100'}]",Rob Bowman,An assassin's change of heart leads her into a war against an evil crime syndicate.,Elektra.jpg
Insidious: The Last Key,2018,"Horror, Mystery, Thriller","[{'source': 'Internet Movie Database', 'value': '5.7/10'}, {'source': 'Rotten Tomatoes', 'value': '34%'}, {'source': 'Metacritic', 'value': '49/100'}]",Adam Robitel,"Parapsychologist Dr. Elise Rainier faces her most fearsome and personal haunting yet, as she is drawn back to her ghostly childhood home where the terror began.",Insidious:_The_Last_Key.jpg
Memento,2000,"Mystery, Thriller","[{'source': 'Internet Movie Database', 'value': '8.4/10'}, {'source': 'Rotten Tomatoes', 'value': '94%'}, {'source': 'Metacritic', 'value': '83/100'}]",Christopher Nolan,"Leonard Shelby, an insurance investigator, suffers from anterograde amnesia and uses notes and tattoos to hunt for the man he thinks killed his wife, which is the last thing he remembers.",Memento.jpg
"Crazy, Stupid, Love.",2011,"Comedy, Drama, Romance","[{'source': 'Internet Movie Database', 'value': '7.4/10'}, {'source': 'Rotten Tomatoes', 'value': '79%'}, {'source': 'Metacritic', 'value': '68/100'}]","Glenn Ficarra, John Requa","A middle-aged husband's life changes dramatically when his wife asks him for a divorce. He seeks to rediscover his manhood with the help of a newfound friend, Jacob, learning to pick up girls at bars.","Crazy,_Stupid,_Love.jpg"
You've Got Mail,1998,"Comedy, Drama, Romance","[{'source': 'Internet Movie Database', 'value': '6.7/10'}, {'source': 'Rotten Tomatoes', 'value': '70%'}, {'source': 'Metacritic', 'value': '58/100'}]",Nora Ephron,"Book superstore magnate Joe Fox and independent book shop owner Kathleen Kelly fall in love in the anonymity of the Internet, both blissfully unaware that he's trying to put her out of business.",You've_Got_Mail.jpg
The Secret Life of Walter Mitty,2013,"Adventure, Comedy, Drama","[{'source': 'Internet Movie Database', 'value': '7.3/10'}, {'source': 'Rotten Tomatoes', 'value': '52%'}, {'source': 'Metacritic', 'value': '54/100'}]",Ben Stiller,"When both he and a colleague are about to lose their job, Walter takes action by embarking on an adventure more extraordinary than anything he ever imagined.",The_Secret_Life_of_Walter_Mitty.jpg
The Hunger Games: Mockingjay - Part 2,2015,"Action, Adventure, Sci-Fi","[{'source': 'Internet Movie Database', 'value': '6.6/10'}, {'source': 'Rotten Tomatoes', 'value': '70%'}, {'source': 'Metacritic', 'value': '65/100'}]",Francis Lawrence,Katniss and a team of rebels from District 13 prepare for the final battle that will decide the fate of Panem.,The_Hunger_Games:_Mockingjay_-_Part_2.jpg
Sixteen Candles,1984,"Comedy, Romance","[{'source': 'Internet Movie Database', 'value': '7.0/10'}, {'source': 'Rotten Tomatoes', 'value': '81%'}, {'source': 'Metacritic', 'value': '61/100'}]",John Hughes,"A girl's ""sweet"" sixteenth birthday is anything but special: her family forgets about it, and she suffers from every embarrassment possible.",Sixteen_Candles.jpg
Army of Darkness,1992,"Comedy, Horror","[{'source': 'Internet Movie Database', 'value': '7.4/10'}, {'source': 'Rotten Tomatoes', 'value': '68%'}, {'source': 'Metacritic', 'value': '59/100'}]",Sam Raimi,"When Ash Williams is accidentally transported to 1300 A.D., he must retrieve the Necronomicon and battle an army of the dead in order to return home.",Army_of_Darkness.jpg
The Orphanage,2007,"Drama, Horror, Mystery","[{'source': 'Internet Movie Database', 'value': '7.4/10'}, {'source': 'Rotten Tomatoes', 'value': '87%'}, {'source': 'Metacritic', 'value': '74/100'}]",J.A. Bayona,"A woman brings her family back to her childhood home, which used to be an orphanage for handicapped children. Before long, her son starts to communicate with an invisible new friend.",The_Orphanage.jpg
X-Men: First Class,2011,"Action, Sci-Fi","[{'source': 'Internet Movie Database', 'value': '7.7/10'}, {'source': 'Rotten Tomatoes', 'value': '86%'}, {'source': 'Metacritic', 'value': '65/100'}]",Matthew Vaughn,"In the 1960s, superpowered humans Charles Xavier and Erik Lensherr work together to find others like them, but Erik's vengeful pursuit of an ambitious mutant who ruined his life causes a schism to divide them.",X-Men:_First_Class.jpg
The Lion King,1994,"Animation, Adventure, Drama","[{'source': 'Internet Movie Database', 'value': '8.5/10'}, {'source': 'Rotten Tomatoes', 'value': '93%'}, {'source': 'Metacritic', 'value': '88/100'}]","Roger Allers, Rob Minkoff","Lion prince Simba and his father are targeted by his bitter uncle, who wants to ascend the throne himself.",The_Lion_King.jpg
The Goonies,1985,"Adventure, Comedy, Family","[{'source': 'Internet Movie Database', 'value': '7.7/10'}, {'source': 'Rotten Tomatoes', 'value': '77%'}, {'source': 'Metacritic', 'value': '62/100'}]",Richard Donner,A group of young misfits called The Goonies discover an ancient map and set out on an adventure to find a legendary pirate's long-lost treasure.,The_Goonies.jpg
Mystic River,2003,"Crime, Drama, Mystery","[{'source': 'Internet Movie Database', 'value': '7.9/10'}, {'source': 'Rotten Tomatoes', 'value': '89%'}, {'source': 'Metacritic', 'value': '84/100'}]",Clint Eastwood,"The tragic murder of a 19-year-old girl reunites three childhood friends still living in Boston--the victim's gangster father, a detective, and the disturbed man they both suspect of killing her.",Mystic_River.jpg
The Machinist,2004,"Drama, Thriller","[{'source': 'Internet Movie Database', 'value': '7.6/10'}, {'source': 'Rotten Tomatoes', 'value': '77%'}, {'source': 'Metacritic', 'value': '61/100'}]",Brad Anderson,An industrial worker who hasn't slept in a year begins to doubt his own sanity.,The_Machinist.jpg
King Kong,2005,"Action, Adventure, Romance","[{'source': 'Internet Movie Database', 'value': '7.2/10'}, {'source': 'Rotten Tomatoes', 'value': '84%'}, {'source': 'Metacritic', 'value': '81/100'}]",Peter Jackson,"A greedy film producer assembles a team of moviemakers and sets out for the infamous Skull Island, where they find more than just cannibalistic natives.",King_Kong.jpg
Beauty and the Beast,1991,"Animation, Family, Fantasy","[{'source': 'Internet Movie Database', 'value': '8.0/10'}, {'source': 'Rotten Tomatoes', 'value': '95%'}, {'source': 'Metacritic', 'value': '95/100'}]","Gary Trousdale, Kirk Wise",A prince cursed to spend his days as a hideous monster sets out to regain his humanity by earning a young woman's love.,Beauty_and_the_Beast.jpg
Terminator Salvation,2009,"Action, Adventure, Sci-Fi","[{'source': 'Internet Movie Database', 'value': '6.5/10'}, {'source': 'Rotten Tomatoes', 'value': '33%'}, {'source': 'Metacritic', 'value': '49/100'}]",McG,"As the machines prepare for a final attack, John Connor and a mysterious stranger delve into the heart of Skynet and uncover a terrible secret involving the annihilation of mankind.",Terminator_Salvation.jpg
Insidious: Chapter 2,2013,"Horror, Mystery, Thriller","[{'source': 'Internet Movie Database', 'value': '6.6/10'}, {'source': 'Rotten Tomatoes', 'value': '38%'}, {'source': 'Metacritic', 'value': '40/100'}]",James Wan,"The Lamberts believe that they have defeated the spirits that have haunted their family, but they soon discover that evil is not beaten so easily.",Insidious:_Chapter_2.jpg
The Count of Monte Cristo,2002,"Action, Adventure, Drama","[{'source': 'Internet Movie Database', 'value': '7.7/10'}, {'source': 'Rotten Tomatoes', 'value': '74%'}, {'source': 'Metacritic', 'value': '61/100'}]",Kevin Reynolds,"A young man, falsely imprisoned by his jealous ""friend"", escapes and uses a hidden treasure to exact his revenge.",The_Count_of_Monte_Cristo.jpg
Ferris Bueller's Day Off,1986,Comedy,"[{'source': 'Internet Movie Database', 'value': '7.8/10'}, {'source': 'Rotten Tomatoes', 'value': '83%'}, {'source': 'Metacritic', 'value': '61/100'}]",John Hughes,"A brash, cocky high school senior, tired of skipping school to spend a boring day at home, is determined to enjoy an epic day roaring around his favorite Chicago sites, enlisting his best friend and girlfriend to join him on the a...",Ferris_Bueller's_Day_Off.jpg
Star Wars: Episode IX - The Rise of Skywalker,2019,"Action, Adventure, Fantasy","[{'source': 'Internet Movie Database', 'value': '6.4/10'}, {'source': 'Rotten Tomatoes', 'value': '51%'}, {'source': 'Metacritic', 'value': '53/100'}]",J.J. Abrams,The surviving Resistance faces the First Order once again in the conclusion of the Skywalker saga.,The_Rise_of_Skywalker.jpg
The Usual Suspects,1995,"Crime, Drama, Mystery","[{'source': 'Internet Movie Database', 'value': '8.5/10'}, {'source': 'Rotten Tomatoes', 'value': '87%'}, {'source': 'Metacritic', 'value': '76/100'}]",Bryan Singer,The sole survivor of a pier shoot-out tells the story of how a notorious criminal influenced the events that began with five criminals meeting in a seemingly random police lineup.,The_Usual_Suspects.jpg
The Thing,1982,"Horror, Mystery, Sci-Fi","[{'source': 'Internet Movie Database', 'value': '8.2/10'}, {'source': 'Rotten Tomatoes', 'value': '85%'}, {'source': 'Metacritic', 'value': '57/100'}]",John Carpenter,A research team in Antarctica is hunted by a shape-shifting alien that assumes the appearance of its victims.,The_Thing.jpg
Pirates of the Caribbean: Dead Men Tell No Tales,2017,"Action, Adventure, Fantasy","[{'source': 'Internet Movie Database', 'value': '6.5/10'}, {'source': 'Rotten Tomatoes', 'value': '30%'}, {'source': 'Metacritic', 'value': '39/100'}]","Joachim Rønning, Espen Sandberg",Captain Jack Sparrow searches for the Trident of Poseidon to rule the sea while being pursued by old rival Captain Salazar and a crew of deadly ghosts who have escaped from the Devil's Triangle.,Pirates_of_the_Caribbean:_Dead_Men_Tell_No_Tales.jpg
E.T. the Extra-Terrestrial,1982,"Adventure, Family, Sci-Fi","[{'source': 'Internet Movie Database', 'value': '7.9/10'}, {'source': 'Rotten Tomatoes', 'value': '99%'}, {'source': 'Metacritic', 'value': '92/100'}]",Steven Spielberg,A troubled child summons the courage to help a friendly alien escape from Earth and return to his home planet.,E.T._the_Extra-Terrestrial.jpg
The Conjuring: The Devil Made Me Do It,2021,"Horror, Mystery, Thriller","[{'source': 'Internet Movie Database', 'value': '6.3/10'}, {'source': 'Rotten Tomatoes', 'value': '56%'}, {'source': 'Metacritic', 'value': '53/100'}]",Michael Chaves,"Arne Cheyenne Johnson stabs and murders his landlord, claiming to be under demonic possession while Ed and Lorraine Warren investigate the case and try to prove his innocence.",The_Conjuring:_The_Devil_Made_Me_Do_It.jpg
Home on the Range,2004,"Animation, Adventure, Comedy","[{'source': 'Internet Movie Database', 'value': '5.4/10'}, {'source': 'Rotten Tomatoes', 'value': '52%'}, {'source': 'Metacritic', 'value': '50/100'}]","Will Finn, John Sanford","To save their farm, the resident animals go bounty hunting for a notorious outlaw.",Home_on_the_Range.jpg
Star Wars: The Empire Strikes Back - The Original Radio Drama,1983,"Action, Adventure, Fantasy","[{'source': 'Internet Movie Database', 'value': '9.0/10'}]",N/A,A radio drama version of 'The Empire Strikes Back'.,Star_Wars:_The_Empire_Strikes_Back.jpg
The Departed,2006,"Crime, Drama, Thriller","[{'source': 'Internet Movie Database', 'value': '8.5/10'}, {'source': 'Rotten Tomatoes', 'value': '91%'}, {'source': 'Metacritic', 'value': '85/100'}]",Martin Scorsese,An undercover cop and a mole in the police attempt to identify each other while infiltrating an Irish gang in South Boston.,The_Departed.jpg
The Maze Runner,2014,"Mystery, Sci-Fi, Thriller","[{'source': 'Internet Movie Database', 'value': '6.8/10'}, {'source': 'Rotten Tomatoes', 'value': '66%'}, {'source': 'Metacritic', 'value': '57/100'}]",Wes Ball,"Thomas is deposited in a community of boys after his memory is erased, soon learning they're all trapped in a maze that will require him to join forces with fellow ""runners"" for a shot at escape.",The_Maze_Runner.jpg
Jurassic World: Fallen Kingdom,2018,"Action, Adventure, Sci-Fi","[{'source': 'Internet Movie Database', 'value': '6.1/10'}, {'source': 'Rotten Tomatoes', 'value': '47%'}, {'source': 'Metacritic', 'value': '51/100'}]",J.A. Bayona,"When the island's dormant volcano begins roaring to life, Owen and Claire mount a campaign to rescue the remaining dinosaurs from this extinction-level event.",Jurassic_World:_Fallen_Kingdom.jpg
The Conjuring,2013,"Horror, Mystery, Thriller","[{'source': 'Internet Movie Database', 'value': '7.5/10'}, {'source': 'Rotten Tomatoes', 'value': '86%'}, {'source': 'Metacritic', 'value': '68/100'}]",James Wan,Paranormal investigators Ed and Lorraine Warren work to help a family terrorized by a dark presence in their farmhouse.,The_Conjuring.jpg
Drive,2011,"Action, Drama","[{'source': 'Internet Movie Database', 'value': '7.8/10'}, {'source': 'Rotten Tomatoes', 'value': '93%'}, {'source': 'Metacritic', 'value': '79/100'}]",Nicolas Winding Refn,A mysterious Hollywood action film stuntman gets in trouble with gangsters when he tries to help his neighbor's husband rob a pawn shop while serving as his getaway driver.,Drive.jpg
Maze Runner: The Scorch Trials,2015,"Action, Adventure, Sci-Fi","[{'source': 'Internet Movie Database', 'value': '6.3/10'}, {'source': 'Rotten Tomatoes', 'value': '49%'}, {'source': 'Metacritic', 'value': '43/100'}]",Wes Ball,"After having escaped the Maze, the Gladers now face a new set of challenges on the open roads of a desolate landscape filled with unimaginable obstacles.",Maze_Runner:_The_Scorch_Trials.jpg
Love Actually,2003,"Comedy, Drama, Romance","[{'source': 'Internet Movie Database', 'value': '7.6/10'}, {'source': 'Rotten Tomatoes', 'value': '64%'}, {'source': 'Metacritic', 'value': '55/100'}]",Richard Curtis,"Follows the lives of eight very different couples in dealing with their love lives in various loosely interrelated tales all set during a frantic month before Christmas in London, England.",Love_Actually.jpg
Black Swan,2010,"Drama, Thriller","[{'source': 'Internet Movie Database', 'value': '8.0/10'}, {'source': 'Rotten Tomatoes', 'value': '85%'}, {'source': 'Metacritic', 'value': '79/100'}]",Darren Aronofsky,"Nina is a talented but unstable ballerina on the verge of stardom. Pushed to the breaking point by her artistic director and a seductive rival, Nina's grip on reality slips, plunging her into a waking nightmare.",Black_Swan.jpg
Inception,2010,"Action, Adventure, Sci-Fi","[{'source': 'Internet Movie Database', 'value': '8.8/10'}, {'source': 'Rotten Tomatoes', 'value': '87%'}, {'source': 'Metacritic', 'value': '74/100'}]",Christopher Nolan,"A thief who steals corporate secrets through the use of dream-sharing technology is given the inverse task of planting an idea into the mind of a C.E.O., but his tragic past may doom the project and his team to disaster.",Inception.jpg
The Mist,2007,"Horror, Sci-Fi, Thriller","[{'source': 'Internet Movie Database', 'value': '7.1/10'}, {'source': 'Rotten Tomatoes', 'value': '73%'}, {'source': 'Metacritic', 'value': '58/100'}]",Frank Darabont,"After a massive thunderstorm, an eerie, unwavering fog descends upon a Maine community. Locals seek refuge in a grocery store from the monstrous creatures now roaming the countryside killing everyone they encounter.",The_Mist.jpg
Shrek the Third,2007,"Animation, Adventure, Comedy","[{'source': 'Internet Movie Database', 'value': '6.1/10'}, {'source': 'Rotten Tomatoes', 'value': '41%'}, {'source': 'Metacritic', 'value': '58/100'}]","Chris Miller, Raman Hui","Reluctantly designated as the heir to the land of Far, Far Away, Shrek hatches a plan to install the rebellious Artie as the new king while Princess Fiona tries to fend off a coup d'état by the jilted Prince Charming.",Shrek_the_Third.jpg
Shrek,2001,"Animation, Adventure, Comedy","[{'source': 'Internet Movie Database', 'value': '7.9/10'}, {'source': 'Rotten Tomatoes', 'value': '88%'}, {'source': 'Metacritic', 'value': '84/100'}]","Andrew Adamson, Vicky Jenson","A mean lord exiles fairytale creatures to the swamp of a grumpy ogre, who must go on a quest and rescue a princess for the lord in order to get his land back.",Shrek.jpg
American Sniper,2014,"Action, Biography, Drama","[{'source': 'Internet Movie Database', 'value': '7.3/10'}, {'source': 'Rotten Tomatoes', 'value': '72%'}, {'source': 'Metacritic', 'value': '73/100'}]",Clint Eastwood,"Navy S.E.A.L. sniper Chris Kyle's pinpoint accuracy saves countless lives on the battlefield and turns him into a legend. Back home with his family after four tours of duty, however, Chris finds that it is the war he can't leave b...",American_Sniper.jpg
The Shape of Water,2017,"Drama, Fantasy, Romance","[{'source': 'Internet Movie Database', 'value': '7.3/10'}, {'source': 'Rotten Tomatoes', 'value': '92%'}, {'source': 'Metacritic', 'value': '87/100'}]",Guillermo del Toro,"At a top secret research facility in the 1960s, a lonely janitor forms a unique relationship with an amphibious creature that is being held in captivity.",The_Shape_of_Water.jpg
Shazam!,2019,"Action, Adventure, Comedy","[{'source': 'Internet Movie Database', 'value': '7.0/10'}, {'source': 'Rotten Tomatoes', 'value': '90%'}, {'source': 'Metacritic', 'value': '71/100'}]",David F. Sandberg,A newly fostered young boy in search of his mother instead finds unexpected super powers and soon gains a powerful enemy.,Shazam!.jpg
Reservoir Dogs,1992,"Crime, Thriller","[{'source': 'Internet Movie Database', 'value': '8.3/10'}, {'source': 'Rotten Tomatoes', 'value': '90%'}, {'source': 'Metacritic', 'value': '81/100'}]",Quentin Tarantino,"When a simple jewelry heist goes horribly wrong, the surviving criminals begin to suspect that one of them is a police informant.",Reservoir_Dogs.jpg
The Amazing Spider-Man,2012,"Action, Adventure, Sci-Fi","[{'source': 'Internet Movie Database', 'value': '6.9/10'}, {'source': 'Rotten Tomatoes', 'value': '71%'}, {'source': 'Metacritic', 'value': '66/100'}]",Marc Webb,"After Peter Parker is bitten by a genetically altered spider, he gains newfound, spider-like powers and ventures out to save the city from the machinations of a mysterious reptilian foe.",The_Amazing_Spider-Man.jpg
Moneyball,2011,"Biography, Drama, Sport","[{'source': 'Internet Movie Database', 'value': '7.6/10'}, {'source': 'Rotten Tomatoes', 'value': '94%'}, {'source': 'Metacritic', 'value': '87/100'}]",Bennett Miller,Oakland A's general manager Billy Beane's successful attempt to assemble a baseball team on a lean budget by employing computer-generated analysis to acquire new players.,Moneyball.jpg
The Lego Batman Movie,2017,"Animation, Action, Adventure","[{'source': 'Internet Movie Database', 'value': '7.3/10'}, {'source': 'Rotten Tomatoes', 'value': '89%'}, {'source': 'Metacritic', 'value': '75/100'}]",Chris McKay,"A cooler-than-ever Bruce Wayne must deal with the usual suspects as they plan to rule Gotham City, while discovering that he has accidentally adopted a teenage orphan who wishes to become his sidekick.",The_Lego_Batman_Movie.jpg
Joseph: King of Dreams,2000,"Animation, Adventure, Biography, Drama, Family, History, Musical","[{'source': 'Internet Movie Database', 'value': '6.5/10'}]","Rob LaDuca, Robert C. Ramirez","A prophet who has the ability to interpret dreams is sold into slavery in Egypt, where people learn of his gifts.",Joseph:_King_of_Dreams.jpg
The Sixth Sense,1999,"Drama, Mystery, Thriller","[{'source': 'Internet Movie Database', 'value': '8.2/10'}, {'source': 'Rotten Tomatoes', 'value': '86%'}, {'source': 'Metacritic', 'value': '64/100'}]",M. Night Shyamalan,"After being shot by a resentful former patient whom he failed to help, a Philadelphia child psychologist seeks redemption by treating a young boy with a disturbing secret.",The_Sixth_Sense.jpg
Silver Linings Playbook,2012,"Comedy, Drama, Romance","[{'source': 'Internet Movie Database', 'value': '7.7/10'}, {'source': 'Rotten Tomatoes', 'value': '92%'}, {'source': 'Metacritic', 'value': '81/100'}]",David O. Russell,"After a stint in a mental institution, former teacher Pat Solitano moves back in with his parents and tries to reconcile with his ex-wife. Things get more challenging when Pat meets Tiffany, a mysterious girl with problems of her ...",Silver_Linings_Playbook.jpg
Justice League,2017,"Action, Adventure, Fantasy","[{'source': 'Internet Movie Database', 'value': '6.1/10'}, {'source': 'Rotten Tomatoes', 'value': '39%'}, {'source': 'Metacritic', 'value': '45/100'}]",Zack Snyder,"Steppenwolf and his Parademons return after eons to capture Earth. However, Batman seeks the help of Wonder Woman to recruit and assemble Flash, Cyborg and Aquaman to fight the powerful new enemy.",Justice_League.jpg
Shrek Forever After,2010,"Animation, Adventure, Comedy","[{'source': 'Internet Movie Database', 'value': '6.3/10'}, {'source': 'Rotten Tomatoes', 'value': '58%'}, {'source': 'Metacritic', 'value': '58/100'}]",Mike Mitchell,Rumpelstiltskin tricks a mid-life crisis burdened Shrek into allowing himself to be erased from existence and cast in a dark alternate timeline where Rumpelstiltskin rules supreme.,Shrek_Forever_After.jpg
The Lord of the Rings: The Return of the King,2003,"Adventure, Drama, Fantasy","[{'source': 'Internet Movie Database', 'value': '9.0/10'}, {'source': 'Rotten Tomatoes', 'value': '94%'}, {'source': 'Metacritic', 'value': '94/100'}]",Peter Jackson,Gandalf and Aragorn lead the World of Men against Sauron's army to draw his gaze from Frodo and Sam as they approach Mount Doom with the One Ring.,The_Lord_of_the_Rings:_The_Return_of_the_King.jpg
Jurassic Park,1993,"Action, Adventure, Sci-Fi","[{'source': 'Internet Movie Database', 'value': '8.2/10'}, {'source': 'Rotten Tomatoes', 'value': '91%'}, {'source': 'Metacritic', 'value': '68/100'}]",Steven Spielberg,"An industrialist invites some experts to visit his theme park of cloned dinosaurs. After a power failure, the creatures run loose, putting everyone's lives, including his grandchildren's, in danger.",Jurassic_Park.jpg
