title,year,user_tags,reviews,author,plot,poster
National Treasure: Book of Secrets,2007,"Action, Adventure, Mystery","[{'source': 'Internet Movie Database', 'value': '6.5/10'}, {'source': 'Rotten Tomatoes', 'value': '35%'}, {'source': 'Metacritic', 'value': '48/100'}]",Jon Turteltaub,Benjamin Gates must follow a clue left in John Wilkes Booth's diary to prove his ancestor's innocence in the assassination of Abraham Lincoln.,National_Treasure:_Book_of_Secrets.jpg
The Fifth Element,1997,"Action, Adventure, Sci-Fi","[{'source': 'Internet Movie Database', 'value': '7.6/10'}, {'source': 'Rotten Tomatoes', 'value': '71%'}, {'source': 'Metacritic', 'value': '52/100'}]",Luc Besson,"In the colorful future, a cab driver unwittingly becomes the central figure in the search for a legendary cosmic weapon to keep Evil and Mr. Zorg at bay.",The_Fifth_Element.jpg
The Breakfast Club,1985,"Comedy, Drama","[{'source': 'Internet Movie Database', 'value': '7.8/10'}, {'source': 'Rotten Tomatoes', 'value': '89%'}, {'source': 'Metacritic', 'value': '66/100'}]",John Hughes,Five high school students meet in Saturday detention and discover how they have a great deal more in common than they thought.,The_Breakfast_Club.jpg
The Aviator,2004,"Biography, Drama","[{'source': 'Internet Movie Database', 'value': '7.5/10'}, {'source': 'Rotten Tomatoes', 'value': '86%'}, {'source': 'Metacritic', 'value': '77/100'}]",Martin Scorsese,A biopic depicting the early years of legendary director and aviator Howard Hughes' career from the late 1920s to the mid 1940s.,The_Aviator.jpg
Mulan II,2004,"Animation, Action, Comedy, Family, Musical","[{'source': 'Internet Movie Database', 'value': '5.7/10'}, {'source': 'Rotten Tomatoes', 'value': '0%'}]","Darrell Rooney, Lynne Southerland","While preparing for their wedding, Shang and Mulan are suddenly sent off on a secret mission. Mushu starts to meddle, and a surprise attack by Mongolians doesn't help either.",Mulan_II.jpg
Hidden Figures,2016,"Biography, Drama, History","[{'source': 'Internet Movie Database', 'value': '7.8/10'}, {'source': 'Rotten Tomatoes', 'value': '93%'}, {'source': 'Metacritic', 'value': '74/100'}]",Theodore Melfi,"Three female African-American mathematicians play a pivotal role in astronaut John Glenn's launch into orbit. Meanwhile, they also have to deal with racial and gender discrimination at work.",Hidden_Figures.jpg
The Shining,1980,"Drama, Horror","[{'source': 'Internet Movie Database', 'value': '8.4/10'}, {'source': 'Rotten Tomatoes', 'value': '83%'}, {'source': 'Metacritic', 'value': '68/100'}]",Stanley Kubrick,"A family heads to an isolated hotel for the winter, where a sinister presence influences the father into violence. At the same time, his psychic son sees horrifying forebodings from both the past and the future.",The_Shining.jpg
Hotel Transylvania,2012,"Animation, Adventure, Comedy","[{'source': 'Internet Movie Database', 'value': '7.0/10'}, {'source': 'Rotten Tomatoes', 'value': '45%'}, {'source': 'Metacritic', 'value': '47/100'}]",Genndy Tartakovsky,"Dracula, who operates a high-end resort away from the human world, goes into overprotective mode when a boy discovers the resort and falls for the count's teenaged daughter.",Hotel_Transylvania.jpg
The Hunger Games,2012,"Action, Adventure, Sci-Fi","[{'source': 'Internet Movie Database', 'value': '7.2/10'}, {'source': 'Rotten Tomatoes', 'value': '84%'}, {'source': 'Metacritic', 'value': '68/100'}]",Gary Ross,Katniss Everdeen voluntarily takes her younger sister's place in the Hunger Games: a televised competition in which two teenagers from each of the twelve Districts of Panem are chosen at random to fight to the death.,The_Hunger_Games.jpg
Fantastic Four (2015),2015,N/A,[],N/A,N/A,N/A
Us,2019,"Horror, Mystery, Thriller","[{'source': 'Internet Movie Database', 'value': '6.8/10'}, {'source': 'Rotten Tomatoes', 'value': '93%'}, {'source': 'Metacritic', 'value': '81/100'}]",Jordan Peele,"In order to get away from their busy lives, the Wilson family takes a vacation to Santa Cruz, California. At night, four strangers break into Adelaide's childhood home. The family is shocked to find out that the intruders look lik...",Us.jpg
The Great Mouse Detective,1986,"Animation, Adventure, Family","[{'source': 'Internet Movie Database', 'value': '7.1/10'}, {'source': 'Rotten Tomatoes', 'value': '78%'}, {'source': 'Metacritic', 'value': '73/100'}]","Ron Clements, Burny Mattinson, Dave Michener","Basil, the rodent Sherlock Holmes, investigates the kidnapping of a toy maker and uncovers its link to his archenemy, Professor Ratigan.",The_Great_Mouse_Detective.jpg
Christine,1983,"Horror, Thriller","[{'source': 'Internet Movie Database', 'value': '6.8/10'}, {'source': 'Rotten Tomatoes', 'value': '73%'}, {'source': 'Metacritic', 'value': '57/100'}]",John Carpenter,A nerdish boy buys a strange car with an evil mind of its own and his nature starts to change to reflect it.,Christine.jpg
X-Men,2000,"Action, Adventure, Sci-Fi","[{'source': 'Internet Movie Database', 'value': '7.3/10'}, {'source': 'Rotten Tomatoes', 'value': '82%'}, {'source': 'Metacritic', 'value': '64/100'}]",Bryan Singer,"In a world where mutants (evolved super-powered humans) exist and are discriminated against, two groups form for an inevitable clash: the supremacist Brotherhood, and the pacifist X-Men.",X-Men.jpg
A Nightmare on Elm Street,1984,Horror,"[{'source': 'Internet Movie Database', 'value': '7.4/10'}, {'source': 'Rotten Tomatoes', 'value': '94%'}, {'source': 'Metacritic', 'value': '76/100'}]",Wes Craven,"Teenager Nancy Thompson must uncover the dark truth concealed by her parents after she and her friends become targets of the spirit of a serial killer with a bladed glove in their dreams, in which if they die, it kills them in rea...",Nightmare_on_Elm_Street.jpg
Hush,2016,"Horror, Thriller","[{'source': 'Internet Movie Database', 'value': '6.6/10'}, {'source': 'Rotten Tomatoes', 'value': '91%'}, {'source': 'Metacritic', 'value': '67/100'}]",Mike Flanagan,A deaf and mute writer who retreated into the woods to live a solitary life must fight for her life in silence when a masked killer appears at her window.,Hush.jpg
Ice Age: The Meltdown,2006,"Animation, Adventure, Comedy","[{'source': 'Internet Movie Database', 'value': '6.8/10'}, {'source': 'Rotten Tomatoes', 'value': '56%'}, {'source': 'Metacritic', 'value': '59/100'}]",Carlos Saldanha,"Manny, Sid and Diego discover that the ice age is coming to an end, and join everybody for a journey to higher ground. On the trip, they discover that Manny is not in fact the last of the woolly mammoths.",Ice_Age:_The_Meltdown.jpg
X-Men: Apocalypse,2016,"Action, Adventure, Sci-Fi","[{'source': 'Internet Movie Database', 'value': '6.8/10'}, {'source': 'Rotten Tomatoes', 'value': '47%'}, {'source': 'Metacritic', 'value': '52/100'}]",Bryan Singer,"In the 1980s, the X-Men must defeat an ancient all-powerful mutant, En Sabah Nur, who intends to thrive by bringing destruction to the world.",X-Men:_Apocalypse.jpg
The Wolverine,2013,"Action, Sci-Fi","[{'source': 'Internet Movie Database', 'value': '6.7/10'}, {'source': 'Rotten Tomatoes', 'value': '71%'}, {'source': 'Metacritic', 'value': '61/100'}]",James Mangold,"Wolverine comes to Japan to meet an old friend whose life he saved years ago, and gets embroiled in a conspiracy involving yakuza and mutants.",The_Wolverine.jpg
Titanic,1997,"Drama, Romance","[{'source': 'Internet Movie Database', 'value': '7.9/10'}, {'source': 'Rotten Tomatoes', 'value': '88%'}, {'source': 'Metacritic', 'value': '75/100'}]",James Cameron,"A seventeen-year-old aristocrat falls in love with a kind but poor artist aboard the luxurious, ill-fated R.M.S. Titanic.",Titanic.jpg
Antz,1998,"Animation, Adventure, Comedy","[{'source': 'Internet Movie Database', 'value': '6.5/10'}, {'source': 'Rotten Tomatoes', 'value': '92%'}, {'source': 'Metacritic', 'value': '73/100'}]","Eric Darnell, Tim Johnson, Lawrence Guterman",A rather neurotic ant tries to break from his totalitarian society while trying to win the affection of the princess he loves.,Antz.jpg
Dallas Buyers Club,2013,"Biography, Drama","[{'source': 'Internet Movie Database', 'value': '7.9/10'}, {'source': 'Rotten Tomatoes', 'value': '92%'}, {'source': 'Metacritic', 'value': '77/100'}]",Jean-Marc Vallée,"In 1985 Dallas, electrician and hustler Ron Woodroof works around the system to help AIDS patients get the medication they need after he is diagnosed with the disease.",Dallas_Buyers_Club.jpg
The Town,2010,"Crime, Drama, Thriller","[{'source': 'Internet Movie Database', 'value': '7.5/10'}, {'source': 'Rotten Tomatoes', 'value': '92%'}, {'source': 'Metacritic', 'value': '74/100'}]",Ben Affleck,A proficient group of thieves rob a bank and hold the manager hostage. Things begin to get complicated when one of the crew members falls in love with her.,The_Town.jpg
The Holiday,2006,"Comedy, Romance","[{'source': 'Internet Movie Database', 'value': '7.0/10'}, {'source': 'Rotten Tomatoes', 'value': '51%'}, {'source': 'Metacritic', 'value': '52/100'}]",Nancy Meyers,"Amanda lives in LA and is a movie trailer editor. Iris lives in Surrey and is a journalist. The two decide to swap houses for two weeks at Christmas - both trying to forget their troubled love lives, until love finds them anyways.",The_Holiday.jpg
The Silence of the Lambs,1991,"Crime, Drama, Thriller","[{'source': 'Internet Movie Database', 'value': '8.6/10'}, {'source': 'Rotten Tomatoes', 'value': '95%'}, {'source': 'Metacritic', 'value': '86/100'}]",Jonathan Demme,"A young F.B.I. cadet must receive the help of an incarcerated and manipulative cannibal killer to help catch another serial killer, a madman who skins his victims.",The_Silence_of_the_Lambs.jpg
Peter Rabbit,2018,"Animation, Adventure, Comedy","[{'source': 'Internet Movie Database', 'value': '6.6/10'}, {'source': 'Metacritic', 'value': '51/100'}]",Will Gluck,"A rabbit sneaks into a garden to steal food, and they get a new challenge with a new owner.",Peter_Rabbit.jpg
Les Misérables,2012,"Drama, Musical, Romance","[{'source': 'Internet Movie Database', 'value': '7.5/10'}, {'source': 'Rotten Tomatoes', 'value': '70%'}, {'source': 'Metacritic', 'value': '63/100'}]",Tom Hooper,"In 19th-century France, Jean Valjean, who, for decades, has been hunted by the ruthless policeman Javert after breaking parole, agrees to care for a factory worker's daughter. The decision changes their lives forever.",Les_Misérables.jpg
Maya the Bee Movie,2014,"Animation, Adventure, Comedy","[{'source': 'Internet Movie Database', 'value': '5.9/10'}, {'source': 'Rotten Tomatoes', 'value': '50%'}, {'source': 'Metacritic', 'value': '49/100'}]",Alexs Stadermann,Maya is a little bee with a big heart! Join her on an epic adventure.,The_Bee_Movie.jpg
Knock Knock,2015,"Crime, Thriller","[{'source': 'Internet Movie Database', 'value': '4.9/10'}, {'source': 'Rotten Tomatoes', 'value': '37%'}, {'source': 'Metacritic', 'value': '53/100'}]",Eli Roth,"A devoted husband and father helps two stranded young women who knock on his door, but his kind gesture turns into a dangerous seduction and a deadly game of cat and mouse.",Knock_Knock.jpg
Stand by Me,1986,"Adventure, Comedy, Drama","[{'source': 'Internet Movie Database', 'value': '8.1/10'}, {'source': 'Rotten Tomatoes', 'value': '92%'}, {'source': 'Metacritic', 'value': '75/100'}]",Rob Reiner,A writer recounts a childhood journey with his friends to find the body of a missing boy.,Stand_by_Me.jpg
Allegiant,2016,"Action, Adventure, Mystery","[{'source': 'Internet Movie Database', 'value': '5.7/10'}, {'source': 'Rotten Tomatoes', 'value': '11%'}, {'source': 'Metacritic', 'value': '33/100'}]",Robert Schwentke,"After the earth-shattering revelations of Insurgent, Tris must escape with Four beyond the wall that encircles Chicago to finally discover the shocking truth of the world outside.",Allegiant.jpg
The Sandlot,1993,"Comedy, Drama, Family","[{'source': 'Internet Movie Database', 'value': '7.8/10'}, {'source': 'Rotten Tomatoes', 'value': '65%'}, {'source': 'Metacritic', 'value': '55/100'}]",David Mickey Evans,"In the summer of 1962, a new kid in town is taken under the wing of a young baseball prodigy and his rowdy team, resulting in many adventures.",The_Sandlot.jpg
The Invitation,2015,"Drama, Horror, Mystery","[{'source': 'Internet Movie Database', 'value': '6.6/10'}, {'source': 'Rotten Tomatoes', 'value': '90%'}, {'source': 'Metacritic', 'value': '74/100'}]",Karyn Kusama,"When a man accepts an invitation to a dinner party hosted by his ex-wife, the unsettling past reopens old wounds and creates new tensions.",The_Invitation.jpg
Jurassic World,2015,"Action, Adventure, Sci-Fi","[{'source': 'Internet Movie Database', 'value': '6.9/10'}, {'source': 'Rotten Tomatoes', 'value': '72%'}, {'source': 'Metacritic', 'value': '59/100'}]",Colin Trevorrow,"A new theme park, built on the original site of Jurassic Park, creates a genetically modified hybrid dinosaur, the Indominus Rex, which escapes containment and goes on a killing spree.",Jurassic_World.jpg
Fight Club,1999,Drama,"[{'source': 'Internet Movie Database', 'value': '8.8/10'}, {'source': 'Rotten Tomatoes', 'value': '81%'}, {'source': 'Metacritic', 'value': '67/100'}]",David Fincher,An insomniac office worker and a devil-may-care soap maker form an underground fight club that evolves into much more.,Fight_Club.jpg
The Hunger Games: Mockingjay - Part 1,2014,"Action, Adventure, Sci-Fi","[{'source': 'Internet Movie Database', 'value': '6.6/10'}, {'source': 'Rotten Tomatoes', 'value': '70%'}, {'source': 'Metacritic', 'value': '64/100'}]",Francis Lawrence,"Katniss Everdeen is in District 13 after she shatters the games forever. Under the leadership of President Coin and the advice of her trusted friends, Katniss spreads her wings as she fights to save Peeta and a nation moved by her...",The_Hunger_Games:_Mockingjay_-_Part_1.jpg
The Happening,2008,"Adventure, Drama, Sci-Fi","[{'source': 'Internet Movie Database', 'value': '5.0/10'}, {'source': 'Rotten Tomatoes', 'value': '17%'}, {'source': 'Metacritic', 'value': '34/100'}]",M. Night Shyamalan,"A science teacher, his wife, and a young girl struggle to survive a plague that causes those infected to commit suicide.",The_Happening.jpg
The Fox and the Hound,1981,"Animation, Adventure, Drama","[{'source': 'Internet Movie Database', 'value': '7.2/10'}, {'source': 'Rotten Tomatoes', 'value': '75%'}, {'source': 'Metacritic', 'value': '65/100'}]","Ted Berman, Richard Rich, Art Stevens","A fox named Tod and a hound named Copper vow to be best friends forever. But as Copper grows into a hunting dog, their unlikely friendship faces the ultimate test.",The_Fox_and_the_Hound.jpg
Luca,2021,"Animation, Adventure, Comedy","[{'source': 'Internet Movie Database', 'value': '7.4/10'}, {'source': 'Rotten Tomatoes', 'value': '91%'}, {'source': 'Metacritic', 'value': '71/100'}]",Enrico Casarosa,"On the Italian Riviera, an unlikely but strong friendship grows between a human being and a sea monster disguised as a human.",Luca.jpg
The Road to El Dorado,2000,"Animation, Adventure, Comedy","[{'source': 'Internet Movie Database', 'value': '6.9/10'}, {'source': 'Rotten Tomatoes', 'value': '50%'}, {'source': 'Metacritic', 'value': '51/100'}]","Bibo Bergeron, Don Paul, Jeffrey Katzenberg","Two swindlers get their hands on a map to the fabled city of gold, El Dorado.",The_Road_to_El_Dorado.jpg
Treasure Planet,2002,"Animation, Adventure, Family","[{'source': 'Internet Movie Database', 'value': '7.2/10'}, {'source': 'Rotten Tomatoes', 'value': '69%'}, {'source': 'Metacritic', 'value': '60/100'}]","Ron Clements, John Musker","Jim Hawkins is a teenager who finds the map of a great treasure hidden by a space pirate. Together with some friends, he sets off in a large spaceship, shaped like a caravel, on his quest.",Treasure_Planet.jpg
Shrek 2,2004,"Animation, Adventure, Comedy","[{'source': 'Internet Movie Database', 'value': '7.4/10'}, {'source': 'Rotten Tomatoes', 'value': '89%'}, {'source': 'Metacritic', 'value': '75/100'}]","Andrew Adamson, Kelly Asbury, Conrad Vernon","Shrek and Fiona travel to the Kingdom of Far Far Away, where Fiona's parents are King and Queen, to celebrate their marriage. When they arrive, they find they are not as welcome as they thought they would be.",Shrek_2.jpg
28 Days Later,2002,"Drama, Horror, Sci-Fi","[{'source': 'Internet Movie Database', 'value': '7.5/10'}, {'source': 'Rotten Tomatoes', 'value': '87%'}, {'source': 'Metacritic', 'value': '73/100'}]",Danny Boyle,"Four weeks after a mysterious, incurable virus spreads throughout the United Kingdom, a handful of survivors try to find sanctuary.",28_Days_Later.jpg
The Fox and the Hound 2,2006,"Animation, Adventure, Comedy, Family, Musical","[{'source': 'Internet Movie Database', 'value': '5.3/10'}, {'source': 'Rotten Tomatoes', 'value': '20%'}]",Jim Kammerud,"Tod and Copper still go together like an itch and a scratch, but when Copper gets a shot at the big time with a nutty group of hound dog howlers, their purebred friendship is put to the test.",The_Fox_and_the_Hound_2.jpg
Grease,1978,"Comedy, Musical, Romance","[{'source': 'Internet Movie Database', 'value': '7.2/10'}, {'source': 'Rotten Tomatoes', 'value': '66%'}, {'source': 'Metacritic', 'value': '70/100'}]",Randal Kleiser,"Good girl Sandy Olsson and greaser Danny Zuko fell in love over the summer. When they unexpectedly discover they're now in the same high school, will they be able to rekindle their romance?",Grease.jpg
Goodfellas,1990,"Biography, Crime, Drama","[{'source': 'Internet Movie Database', 'value': '8.7/10'}, {'source': 'Rotten Tomatoes', 'value': '94%'}, {'source': 'Metacritic', 'value': '92/100'}]",Martin Scorsese,"The story of Henry Hill and his life in the mafia, covering his relationship with his wife Karen and his mob partners Jimmy Conway and Tommy DeVito.",Goodfellas.jpg
The Devil Wears Prada,2006,"Comedy, Drama","[{'source': 'Internet Movie Database', 'value': '6.9/10'}, {'source': 'Rotten Tomatoes', 'value': '75%'}, {'source': 'Metacritic', 'value': '62/100'}]",David Frankel,"With an aspiration to become a journalist, Andy, a smart but sensible young graduate, travels to New York. She starts working as an assistant to one of the city's biggest high fashion magazine editors, the cynical Miranda Priestly.",The_Devil_Wears_Prada.jpg
Coco,2017,"Animation, Adventure, Drama","[{'source': 'Internet Movie Database', 'value': '8.4/10'}, {'source': 'Rotten Tomatoes', 'value': '97%'}, {'source': 'Metacritic', 'value': '81/100'}]","Lee Unkrich, Adrian Molina","Aspiring musician Miguel, confronted with his family's ancestral ban on music, enters the Land of the Dead to find his great-great-grandfather, a legendary singer.",Coco.jpg
Pirates of the Caribbean: The Curse of the Black Pearl,2003,"Action, Adventure, Fantasy","[{'source': 'Internet Movie Database', 'value': '8.1/10'}, {'source': 'Rotten Tomatoes', 'value': '79%'}, {'source': 'Metacritic', 'value': '63/100'}]",Gore Verbinski,"Blacksmith Will Turner teams up with eccentric pirate ""Captain"" Jack Sparrow to save Elizabeth Swann, the governor's daughter and his love, from Jack's former pirate allies, who are now undead.",Pirates_of_the_Caribbean:_The_Curse_of_the_Black_Pearl.jpg
Inglourious Basterds,2009,"Adventure, Drama, War","[{'source': 'Internet Movie Database', 'value': '8.4/10'}, {'source': 'Rotten Tomatoes', 'value': '89%'}, {'source': 'Metacritic', 'value': '69/100'}]",Quentin Tarantino,"In Nazi-occupied France during World War II, a plan to assassinate Nazi leaders by a group of Jewish U.S. soldiers coincides with a theatre owner's vengeful plans for the same.",Inglourious_Basterds.jpg
Ice Age,2002,"Animation, Adventure, Comedy","[{'source': 'Internet Movie Database', 'value': '7.5/10'}, {'source': 'Rotten Tomatoes', 'value': '77%'}, {'source': 'Metacritic', 'value': '61/100'}]","Chris Wedge, Carlos Saldanha","Manny the mammoth, Sid the loquacious sloth, and Diego the sabre-toothed tiger go on a comical quest to return a human baby back to his father, across a world on the brink of an ice age.",Ice_Age.jpg
The Cabin in the Woods,2011,"Horror, Mystery, Thriller","[{'source': 'Internet Movie Database', 'value': '7.0/10'}, {'source': 'Rotten Tomatoes', 'value': '92%'}, {'source': 'Metacritic', 'value': '72/100'}]",Drew Goddard,A group of kids go to a remote cabin in the woods where their fate is unknowingly controlled by technicians as part of a world-wide conspiracy where all horror movie clichés are revealed to be part of an elaborate sacrifice ritual.,The_Cabin_in_the_Woods.jpg
Megamind,2010,"Animation, Action, Adventure","[{'source': 'Internet Movie Database', 'value': '7.3/10'}, {'source': 'Rotten Tomatoes', 'value': '73%'}, {'source': 'Metacritic', 'value': '63/100'}]",Tom McGrath,"Evil genius Megamind finally defeats his do-gooder nemesis, Metro Man, but is left without a purpose in a superhero-free world.",Megamind.jpg
Cars 2,2011,"Animation, Adventure, Comedy","[{'source': 'Internet Movie Database', 'value': '6.2/10'}, {'source': 'Rotten Tomatoes', 'value': '39%'}, {'source': 'Metacritic', 'value': '57/100'}]","John Lasseter, Bradford Lewis",Star race car Lightning McQueen and his pal Mater head overseas to compete in the World Grand Prix race. But the road to the championship becomes rocky as Mater gets caught up in an intriguing adventure of his own: international e...,Cars_2.jpg
The Intern,2015,"Comedy, Drama","[{'source': 'Internet Movie Database', 'value': '7.1/10'}, {'source': 'Rotten Tomatoes', 'value': '60%'}, {'source': 'Metacritic', 'value': '51/100'}]",Nancy Meyers,"Seventy-year-old widower Ben Whittaker has discovered that retirement isn't all it's cracked up to be. Seizing an opportunity to get back in the game, he becomes a senior intern at an online fashion site, founded and run by Jules ...",The_Intern.jpg
Cloudy with a Chance of Meatballs,2009,"Animation, Adventure, Comedy","[{'source': 'Internet Movie Database', 'value': '6.9/10'}, {'source': 'Rotten Tomatoes', 'value': '85%'}, {'source': 'Metacritic', 'value': '66/100'}]","Phil Lord, Christopher Miller",A local scientist is often regarded as a failure until he invents a machine that can make food fall from the sky. But little does he know that things are about to take a turn for the worst.,Cloudy_with_a_Chance_of_Meatballs.jpg
The Lego Movie 2: The Second Part,2019,"Animation, Adventure, Comedy","[{'source': 'Internet Movie Database', 'value': '6.5/10'}, {'source': 'Rotten Tomatoes', 'value': '84%'}, {'source': 'Metacritic', 'value': '65/100'}]",Mike Mitchell,"It's been five years since everything was awesome and the citizens are facing the huge new threat of Lego Duplo, invaders from outer space, wrecking everything faster than they can rebuild.",The_Lego_Movie_2.jpg
Scarface,1983,"Crime, Drama","[{'source': 'Internet Movie Database', 'value': '8.3/10'}, {'source': 'Rotten Tomatoes', 'value': '79%'}, {'source': 'Metacritic', 'value': '65/100'}]",Brian De Palma,"In the 1980s, a determined criminal-minded Cuban immigrant becomes the biggest drug smuggler in Miami, and is eventually undone by his own drug addiction.",Scarface.jpg
Deadpool,2016,"Action, Comedy","[{'source': 'Internet Movie Database', 'value': '8.0/10'}, {'source': 'Rotten Tomatoes', 'value': '85%'}, {'source': 'Metacritic', 'value': '65/100'}]",Tim Miller,"A wisecracking mercenary gets experimented on and becomes immortal yet hideously scarred, and sets out to track down the man who ruined his looks.",Deadpool.jpg
Kill Bill: Vol. 1,2003,"Action, Crime, Thriller","[{'source': 'Internet Movie Database', 'value': '8.2/10'}, {'source': 'Rotten Tomatoes', 'value': '85%'}, {'source': 'Metacritic', 'value': '69/100'}]",Quentin Tarantino,"After waking from a four-year coma, a former assassin wreaks vengeance on the team of assassins who betrayed her.",Kill_Bill.jpg
Flashdance,1983,"Drama, Music, Romance","[{'source': 'Internet Movie Database', 'value': '6.2/10'}, {'source': 'Rotten Tomatoes', 'value': '37%'}, {'source': 'Metacritic', 'value': '39/100'}]",Adrian Lyne,"An 18-year-old female amateur dancer who performs nightly at a dancing bar, and works as a welder during the day, dreams of joining the Pittsburgh ballet school.",Flashdance.jpg
Aquaman,2018,"Action, Adventure, Fantasy","[{'source': 'Internet Movie Database', 'value': '6.8/10'}, {'source': 'Rotten Tomatoes', 'value': '66%'}, {'source': 'Metacritic', 'value': '55/100'}]",James Wan,"Arthur Curry, the human-born heir to the underwater kingdom of Atlantis, goes on a quest to prevent a war between the worlds of ocean and land.",Aquaman.jpg
The Big Short,2015,"Biography, Comedy, Drama","[{'source': 'Internet Movie Database', 'value': '7.8/10'}, {'source': 'Rotten Tomatoes', 'value': '89%'}, {'source': 'Metacritic', 'value': '81/100'}]",Adam McKay,"In 2006-2007 a group of investors bet against the United States mortgage market. In their research, they discover how flawed and corrupt the market is.",The_Big_Short.jpg
Back to the Future,1985,"Adventure, Comedy, Sci-Fi","[{'source': 'Internet Movie Database', 'value': '8.5/10'}, {'source': 'Rotten Tomatoes', 'value': '93%'}, {'source': 'Metacritic', 'value': '87/100'}]",Robert Zemeckis,"Marty McFly, a 17-year-old high school student, is accidentally sent 30 years into the past in a time-traveling DeLorean invented by his close friend, the maverick scientist Doc Brown.",Back_to_the_Future.jpg
Blade: Trinity,2004,"Action, Horror, Sci-Fi","[{'source': 'Internet Movie Database', 'value': '5.8/10'}, {'source': 'Rotten Tomatoes', 'value': '24%'}, {'source': 'Metacritic', 'value': '38/100'}]",David S. Goyer,"Blade, now a wanted man by the FBI, must join forces with the Nightstalkers to face his most challenging enemy yet: Dracula.",Blade:_Trinity.jpg
